Symbol,Name,Last Sale,Net Change,% Change,Market Cap,Country,IPO Year,Volume,Sector,Industry
RELL,Richardson Electronics Ltd. Common Stock,$6.434,0.184,2.944%,84978046.00,United States,1983,23053,Technology,Electronic Components
REPH,Recro Pharma Inc. Common Stock,$3.07,-0.15,-4.658%,101968279.00,United States,2014,232346,Health Care,Major Pharmaceuticals
REPL,Replimune Group Inc. Common Stock,$32.45,0.70,2.205%,1508713004.00,United States,2018,202361,Health Care,Biotechnology: Biological Products (No Diagnostic Substances)
RESN,Resonant Inc. Common Stock,$4.065,-0.145,-3.444%,244385922.00,United States,2014,962677,Technology,Semiconductors
RETA,Reata Pharmaceuticals Inc. Class A Common Stock,$96.24,-4.67,-4.628%,3483977022.00,United States,2016,155022,Health Care,Major Pharmaceuticals
RETO,ReTo Eco-Solutions Inc. Common Shares,$1.4987,0.0487,3.359%,36171125.00,China,2017,251337,Capital Goods,Industrial Machinery/Components
REVHU,Revolution Healthcare Acquisition Corp. SAIL Units,$10.0101,0.0401,0.402%,0.00,United States,2021,891956,Finance,Business Services
REYN,Reynolds Consumer Products Inc. Common Stock,$29.97,-0.03,-0.10%,6284723985.00,United States,2020,131622,Consumer Durables,Containers/Packaging
RFIL,RF Industries Ltd. Common Stock,$6.085,-0.065,-1.057%,60682395.00,United States,,41541,Capital Goods,Electrical Products
RGCO,RGC Resources Inc. Common Stock,$22.44,0.26,1.172%,184354451.00,United States,,42024,Public Utilities,Oil & Gas Production
RGEN,Repligen Corporation Common Stock,$181.34,0.97,0.538%,9932235340.00,United States,1986,521969,Health Care,Biotechnology: Biological Products (No Diagnostic Substances)
RGLD,Royal Gold Inc. Common Stock,$105.62,2.26,2.187%,6929358108.00,United States,,226134,Basic Industries,Precious Metals
RGLS,Regulus Therapeutics Inc. Common Stock,$1.5099,-0.0401,-2.587%,109474955.00,United States,2012,410985,Health Care,Major Pharmaceuticals
RGNX,REGENXBIO Inc. Common Stock,$34.19,-0.35,-1.013%,1453023134.00,United States,2015,198778,Health Care,Biotechnology: Biological Products (No Diagnostic Substances)
RGP,Resources Connection Inc. Common Stock,$13.44,0.03,0.224%,436911619.00,United States,,88893,Miscellaneous,Business Services
RIBT,RiceBran Technologies Common Stock,$0.9801,0.0003,0.031%,44337849.00,United States,,170839,Consumer Non-Durables,Packaged Foods
RICK,RCI Hospitality Holdings Inc. Common Stock,$61.62,-2.70,-4.198%,554574454.00,United States,1995,42177,Consumer Services,Restaurants
RIDE,Lordstown Motors Corp. Class A Common Stock,$11.82,-0.48,-3.902%,1949696270.00,United States,2019,5248941,Capital Goods,Auto Manufacturing
RIGL,Rigel Pharmaceuticals Inc. Common Stock,$3.425,-0.185,-5.125%,582393329.00,United States,2000,1312652,Health Care,Major Pharmaceuticals
RILY,B. Riley Financial Inc. Common Stock,$54.07,-0.12,-0.221%,1470222344.00,United States,,112083,Miscellaneous,Business Services
RILYG,B. Riley Financial Inc. 7.25% Senior Notes due 2027,$25.39,-0.01,-0.039%,0.00,United States,,36902,Miscellaneous,Business Services
RILYH,B. Riley Financial Inc. 7.375% Senior Notes due 2023,$25.93,0.00,0.00%,0.00,United States,,449,Miscellaneous,Business Services
RILYI,B. Riley Financial Inc. 6.875% Senior Notes due 2023,$25.77,0.01,0.039%,0.00,United States,,3143,Miscellaneous,Business Services
RILYL,B. Riley Financial Inc. Depositary Shares each representing 1/1000th in a share of 7.375% Series B Cumulative Perpetual Preferred Stock par value $0.0001,$27.30,0.0532,0.195%,0.00,United States,,2053,Miscellaneous,Business Services
RILYM,B. Riley Financial Inc. 6.375% Senior Notes due 2025,$25.8835,0.1335,0.518%,0.00,United States,,9718,Miscellaneous,Business Services
RILYN,B. Riley Financial Inc. 6.50% Senior Notes Due 2026,$26.225,0.21,0.807%,0.00,United States,,5388,Miscellaneous,Business Services
RILYO,B. Riley Financial Inc. 6.75% Senior Notes due 2024,$25.72,-0.08,-0.31%,0.00,United States,,5361,Miscellaneous,Business Services
RILYP,B. Riley Financial Inc. Depositary Shares each representing a 1/1000th fractional interest in a share of Series A Cumulative Perpetual Preferred Stock,$26.70,0.02,0.075%,0.00,United States,,4987,Miscellaneous,Business Services
RILYT,B. Riley Financial Inc. 6.00% Senior Notes Due 2028,$25.375,-0.035,-0.138%,0.00,United States,,41401,Miscellaneous,Business Services
RILYZ,B. Riley Financial Inc. 7.50% Senior Notes Due 2027,$25.30,0.00,0.00%,0.00,United States,,30116,Miscellaneous,Business Services
RIOT,Riot Blockchain Inc.  Common Stock ,$47.3699,-0.8001,-1.661%,3198884942.00,United States,,13255124,Technology,EDP Services
RIVE,Riverview Financial Corporation Common Stock,$10.67,0.00,0.00%,99729502.00,United States,,4942,Finance,Major Banks
RKDA,Arcadia Biosciences Inc. Common Stock,$2.5201,-0.0899,-3.444%,53747798.00,United States,2015,545343,Consumer Non-Durables,Farming/Seeds/Milling
RLAY,Relay Therapeutics Inc. Common Stock,$33.50,-2.07,-5.82%,3014489963.00,United States,2020,461651,Health Care,Biotechnology: Biological Products (No Diagnostic Substances)
RLMD,Relmada Therapeutics Inc. Common Stock,$33.41,0.19,0.572%,542629384.00,United States,,52064,Health Care,Major Pharmaceuticals
RMBI,Richmond Mutual Bancorporation Inc. Common Stock,$13.78,0.16,1.175%,181251013.00,United States,2019,22290,Finance,Major Banks
RMBL,RumbleOn Inc. Class B Common Stock,$41.95,-3.62,-7.944%,97133799.00,United States,,101002,Technology,EDP Services
RMBS,Rambus Inc. Common Stock,$19.39,0.35,1.838%,2166451234.00,United States,1997,297835,Technology,Semiconductors
RMCF,Rocky Mountain Chocolate Factory Inc. Common Stock,$5.4983,0.0583,1.072%,33398285.00,United States,,19725,Consumer Non-Durables,Specialty Foods
RMGB,RMG Acquisition Corp. II Class A Ordinary Shares,$9.9183,-0.1017,-1.015%,427726688.00,United States,2021,342623,Finance,Business Services
RMGBU,RMG Acquisition Corp. II Unit,$10.3717,-0.0583,-0.559%,0.00,United States,2020,29274,Finance,Business Services
RMGBW,RMG Acquisition Corp. II Warrant,$1.4632,-0.0368,-2.453%,0.00,United States,2021,67080,Finance,Business Services
RMGCU,RMG Acquisition Corp. III Unit,$10.00,0.09,0.908%,0.00,United States,2021,242923,Finance,Business Services
RMNI,Rimini Street Inc. (DE) Common Stock,$8.38,0.08,0.964%,711925758.00,United States,2015,150318,Miscellaneous,Business Services
RMR,The RMR Group Inc. Class A Common Stock,$38.80,0.34,0.884%,636150871.00,United States,,28096,Consumer Services,Professional Services
RMRM,RMR Mortgage Trust Common Stock,$12.01,-0.05,-0.415%,122526128.00,United States,,8236,,
RMTI,Rockwell Medical Inc. (DE) Common Stock,$1.1201,-0.0799,-6.658%,104811302.00,United States,1998,1554536,Health Care,Major Pharmaceuticals
RNA,Avidity Biosciences Inc. Common Stock,$20.485,-1.385,-6.333%,769920531.00,United States,2020,165535,Health Care,Major Pharmaceuticals
RNDB,Randolph Bancorp Inc. Common Stock,$20.00,0.025,0.125%,108294760.00,United States,2016,7804,Finance,Major Banks
RNET,RigNet Inc. Common Stock,$8.82,-0.18,-2.00%,185361146.00,United States,2010,33787,Consumer Services,Telecommunications Equipment
RNLX,Renalytix AI plc American Depositary Shares,$27.17,-0.01,-0.037%,978762380.00,United Kingdom,2020,39669,Health Care,Medical Specialities
RNST,Renasant Corporation Common Stock,$42.65,0.53,1.258%,2398589298.00,United States,,109707,Finance,Major Banks
RNWK,RealNetworks Inc. Common Stock,$4.4099,-0.2301,-4.959%,169894881.00,United States,1997,605869,Technology,EDP Services
ROAD,Construction Partners Inc. Class A Common Stock,$28.70,2.20,8.302%,1486423082.00,United States,2018,529288,Basic Industries,Military/Government/Technical
ROCC,Roth CH Acquisition II Co. Common Stock,$9.915,0.185,1.901%,145254750.00,United States,2021,783703,Finance,Business Services
ROCCU,Roth CH Acquisition II Co. Unit,$10.47,0.32,3.153%,0.00,United States,2020,73625,Finance,Business Services
ROCCW,Roth CH Acquisition II Co. Warrant,$1.2699,0.0899,7.619%,0.00,United States,2021,265120,Finance,Business Services
ROCK,Gibraltar Industries Inc. Common Stock,$90.475,2.345,2.661%,2946857696.00,United States,1993,142649,Capital Goods,Steel/Iron Ore
ROCRU,Roth CH Acquisition III Co. Unit,$9.9701,0.1201,1.219%,0.00,United States,2021,31145,Finance,Business Services
ROCRW,Roth CH Acquisition III Co. Warrant,$1.00,1.00,,0.00,United States,2021,2617,Finance,Business Services
ROIC,Retail Opportunity Investments Corp. Common Stock (MD),$16.26,0.12,0.743%,1920692712.00,United States,,338842,Consumer Services,Real Estate Investment Trusts
ROKU,Roku Inc. Class A Common Stock,$300.2201,-17.3999,-5.478%,38554849170.00,United States,2017,4211742,Consumer Services,Television Services
ROLL,RBC Bearings Incorporated Common Stock,$191.99,2.93,1.55%,4826558524.00,United States,2005,46516,Capital Goods,Metal Fabrications
ROOT,Root Inc. Class A Common Stock,$13.84,0.97,7.537%,3483460710.00,United States,2020,23435679,Finance,Property-Casualty Insurers
ROST,Ross Stores Inc. Common Stock,$121.50,2.51,2.109%,43310266893.00,United States,1985,1376809,Consumer Services,Clothing/Shoe/Accessory Stores
RP,RealPage Inc. Common Stock,$87.31,0.04,0.046%,8913611135.00,United States,2010,318284,Technology,Computer Software: Prepackaged Software
RPAY,Repay Holdings Corporation Class A Common Stock,$22.635,0.035,0.155%,1822720496.00,United States,2018,325298,Miscellaneous,Business Services
RPD,Rapid7 Inc. Common Stock,$72.755,-1.145,-1.549%,3833277025.00,United States,2015,518229,Technology,Computer Software: Prepackaged Software
RPRX,Royalty Pharma plc Class A Ordinary Shares ,$42.03,-0.80,-1.868%,25516869866.00,United States,2020,912559,Health Care,Major Pharmaceuticals
RPTX,Repare Therapeutics Inc. Common Shares,$28.335,-1.715,-5.707%,1045687477.00,Canada,2020,84076,Health Care,Major Pharmaceuticals
RRBI,Red River Bancshares Inc. Common Stock,$58.15,0.13,0.224%,424991427.00,United States,2019,7073,Finance,Major Banks
RRGB,Red Robin Gourmet Burgers Inc. Common Stock,$40.075,1.215,3.127%,624153979.00,United States,2002,307382,Consumer Services,Restaurants
RRR,Red Rock Resorts Inc. Class A Common Stock,$34.59,0.56,1.646%,4057890291.00,United States,2016,393000,Consumer Services,Hotels/Resorts
RSSS,Research Solutions Inc Common Stock,$2.12,-0.0287,-1.336%,55708679.00,United States,,54689,Miscellaneous,Business Services
RSVA,Rodgers Silicon Valley Acquisition Corp. Common Stock,$13.615,0.105,0.777%,391431250.00,United States,2021,101969,Finance,Business Services
RSVAU,Rodgers Silicon Valley Acquisition Corp. Unit,$15.71,0.76,5.084%,0.00,United States,2020,32456,Finance,Business Services
RSVAW,Rodgers Silicon Valley Acquisition Corp. Warrant,$4.47,0.07,1.591%,0.00,United States,2021,18182,Finance,Business Services
RTLR,Rattler Midstream LP Common Units,$10.76,0.40,3.861%,1607836446.00,United States,2019,134126,Public Utilities,Natural Gas Distribution
RTPYU,Reinvent Technology Partners Y Unit,$10.01,0.08,0.806%,0.00,United States,2021,244702,Finance,Business Services
RUBY,Rubius Therapeutics Inc. Common Stock,$23.805,-7.975,-25.094%,2096709264.00,United States,2018,1319952,Health Care,Biotechnology: Biological Products (No Diagnostic Substances)
RUHN,Ruhnn Holding Limited American Depositary Shares,$3.24,-0.03,-0.917%,267802278.00,China,2019,183413,Consumer Services,Catalog/Specialty Distribution
RUN,Sunrun Inc. Common Stock,$55.6356,2.6356,4.973%,11270864198.00,United States,2015,4017435,Capital Goods,Industrial Specialties
RUSHA,Rush Enterprises Inc. Common Stock Cl A,$48.78,0.88,1.837%,2686541866.00,United States,,74746,Consumer Durables,Automotive Aftermarket
RUSHB,Rush Enterprises Inc. Class B,$44.39,0.15,0.339%,2444764113.00,United States,,8158,Consumer Durables,Automotive Aftermarket
RUTH,Ruth's Hospitality Group Inc. Common Stock,$25.28,0.98,4.033%,883827150.00,United States,2005,309356,Consumer Services,Restaurants
RVMD,Revolution Medicines Inc. Common Stock,$42.772,-2.698,-5.934%,3138746487.00,United States,2020,241867,Health Care,Biotechnology: Biological Products (No Diagnostic Substances)
RVNC,Revance Therapeutics Inc. Common Stock,$27.50,0.25,0.917%,1963868858.00,United States,2014,367067,Health Care,Major Pharmaceuticals
RVPH,Reviva Pharmaceuticals Holdings Inc. Common Stock ,$5.95,0.50,9.174%,30550590.00,United States,2020,51519,Health Care,Major Pharmaceuticals
RVPHW,Reviva Pharmaceuticals Holdings Inc. Warrants,$0.41,-0.03,-6.818%,0.00,United States,2018,15313,Health Care,Major Pharmaceuticals
RVSB,Riverview Bancorp Inc Common Stock,$7.14,0.15,2.146%,159544978.00,United States,,26488,Finance,Savings Institutions
RWLK,ReWalk Robotics Ltd. Ordinary Shares,$2.315,-0.165,-6.653%,102709503.00,Israel,2014,1640753,Health Care,Industrial Specialties
RXDX,Prometheus Biosciences Inc. Common Stock,$18.09,-0.61,-3.262%,701064925.00,United States,2021,60347,Health Care,Major Pharmaceuticals
RXRAU,RXR Acquisition Corp. Units,$9.91,0.12,1.226%,0.00,United States,2021,1316,Finance,Business Services
RXT,Rackspace Technology Inc. Common Stock,$23.12,-0.63,-2.653%,4751689841.00,United States,2020,1283455,Technology,Computer Software: Programming Data Processing
RYAAY,Ryanair Holdings plc American Depositary Shares,$114.32,0.20,0.175%,25782750220.00,Ireland,1997,362617,Transportation,Air Freight/Delivery Services
RYTM,Rhythm Pharmaceuticals Inc. Common Stock,$21.52,-0.48,-2.182%,1079898649.00,United States,2017,349110,Health Care,Major Pharmaceuticals
RZLT,Rezolute Inc. Common Stock,$7.0175,0.1175,1.703%,58612104.00,United States,,1214,Health Care,Major Pharmaceuticals
SABR,Sabre Corporation Common Stock,$14.715,-0.225,-1.506%,4669585599.00,United States,2014,4453895,Technology,Computer Software: Programming Data Processing
SABRP,Sabre Corporation 6.50% Series A Mandatory Convertible Preferred Stock,$189.67,8.22,4.53%,,United States,,2208,Technology,Computer Software: Programming Data Processing
SAFM,Sanderson Farms Inc. Common Stock,$157.14,1.77,1.139%,3508998113.00,United States,1987,72377,Consumer Non-Durables,Meat/Poultry/Fish
SAFT,Safety Insurance Group Inc. Common Stock,$84.67,0.34,0.403%,1261049410.00,United States,2002,25466,Finance,Property-Casualty Insurers
SAGE,Sage Therapeutics Inc. Common Stock,$72.74,1.30,1.82%,4246701806.00,United States,2014,207465,Health Care,Major Pharmaceuticals
SAIA,Saia Inc. Common Stock,$225.59,9.51,4.401%,5939714542.00,United States,,123787,Transportation,Trucking Freight/Courier Services
SAII,Software Acquisition Group Inc. II Class A Common Stock,$10.15,0.12,1.196%,218859375.00,United States,2020,104920,Finance,Business Services
SAIIU,Software Acquisition Group Inc. II Unit,$11.1128,0.6928,6.649%,0.00,United States,2020,1460,Finance,Business Services
SAIIW,Software Acquisition Group Inc. II Warrant,$1.65,0.15,10.00%,0.00,United States,2020,85762,Finance,Business Services
SAL,Salisbury Bancorp Inc. Common Stock,$44.22,-0.31,-0.696%,125812400.00,United States,,2958,Finance,Savings Institutions
SALM,Salem Media Group Inc. Class A Common Stock,$2.70,-0.20,-6.897%,72047780.00,United States,1999,498722,Consumer Services,Broadcasting
SAMG,Silvercrest Asset Management Group Inc. Class A Common Stock,$14.01,-0.05,-0.356%,202163347.00,United States,2013,23523,Finance,Investment Managers
SANA,Sana Biotechnology Inc. Common Stock,$30.50,-0.01,-0.033%,5713863168.00,United States,2021,260557,Health Care,Biotechnology: Biological Products (No Diagnostic Substances)
SANM,Sanmina Corporation Common Stock,$41.71,1.18,2.911%,2708087193.00,United States,1993,259663,Technology,Electrical Products
SANW,S&W Seed Company Common Stock (NV),$3.69,-0.06,-1.60%,129442783.00,United States,,73074,Consumer Non-Durables,Farming/Seeds/Milling
SASR,Sandy Spring Bancorp Inc. Common Stock,$43.88,0.80,1.857%,2080933965.00,United States,,141886,Finance,Major Banks
SATS,EchoStar  Corporation Common Stock,$24.35,0.18,0.745%,2263220977.00,United States,,380421,Consumer Services,Telecommunications Equipment
SAVA,Cassava Sciences Inc. Common Stock,$46.28,-3.43,-6.90%,1806553962.00,United States,,1296989,Health Care,Major Pharmaceuticals
SBAC,SBA Communications Corporation Class A Common Stock,$281.31,8.95,3.286%,30752527890.00,United States,1999,303781,Consumer Services,Real Estate Investment Trusts
SBBP,Strongbridge Biopharma plc Ordinary Shares,$2.64,-0.13,-4.693%,178228037.00,United States,2015,631571,Health Care,Major Pharmaceuticals
SBCF,Seacoast Banking Corporation of Florida Common Stock,$36.72,0.61,1.689%,2028775226.00,United States,,99401,Finance,Major Banks
SBEAU,SilverBox Engaged Merger Corp I Units,$9.90,0.06,0.61%,0.00,United States,2021,7649,Finance,Business Services
SBFG,SB Financial Group Inc. Common Stock,$18.80,0.315,1.704%,138924969.00,United States,,5223,Finance,Major Banks
SBGI,Sinclair Broadcast Group Inc. Class A Common Stock,$28.81,-0.53,-1.806%,2133633596.00,United States,1995,1404993,Consumer Services,Broadcasting
SBLK,Star Bulk Carriers Corp. Common Shares,$14.92,-0.33,-2.164%,1480656563.00,Greece,,908270,Transportation,Marine Transportation
SBLKZ,Star Bulk Carriers Corp. 8.30% Senior Notes due 2022,$25.88,0.16,0.622%,0.00,Greece,,214,Transportation,Marine Transportation
SBNY,Signature Bank Common Stock,$216.93,1.11,0.514%,12500571943.00,United States,2004,331001,Finance,Major Banks
SBNYP,Signature Bank Depositary shares each representing a 1/40th ownership interest in a share of 5.000% Noncumulative Perpetual Series A Preferred Stock,$25.455,0.145,0.573%,0.00,United States,,24503,Finance,Major Banks
SBRA,Sabra Health Care REIT Inc. Common Stock,$17.50,-0.02,-0.114%,3687597270.00,United States,,2086799,Consumer Services,Real Estate Investment Trusts
SBSI,Southside Bancshares Inc. Common Stock,$39.32,0.46,1.184%,1288026905.00,United States,,53322,Finance,Major Banks
SBT,Sterling Bancorp Inc. Common Stock,$5.67,0.07,1.25%,283397152.00,United States,2017,9495,Finance,Savings Institutions
SBTX,Silverback Therapeutics Inc. Common Stock,$48.05,-1.96,-3.919%,1671741617.00,United States,2020,165544,Health Care,Major Pharmaceuticals
SBUX,Starbucks Corporation Common Stock,$108.80,1.45,1.351%,128090240000.00,United States,1992,3585914,Consumer Services,Restaurants
SCAQU,Stratim Cloud Acquisition Corp. Unit,$9.89,-0.09,-0.902%,0.00,United States,2021,3618,Finance,Business Services
SCHL,Scholastic Corporation Common Stock,$29.21,0.29,1.003%,1002724707.00,United States,1992,91046,Consumer Services,Books
SCHN,Schnitzer Steel Industries Inc. Class A Common Stock,$43.10,3.50,8.838%,1183254815.00,United States,1993,246885,Consumer Durables,Industrial Specialties
SCKT,Socket Mobile Inc. Common Stock,$7.96,-0.31,-3.748%,55173817.00,United States,,132762,Technology,Computer Manufacturing
SCLEU,Broadscale Acquisition Corp. Units,$9.98,0.13,1.32%,0.00,United States,2021,48174,Finance,Business Services
SCOA,ScION Tech Growth I Class A Ordinary Shares,$9.81,0.10,1.03%,0.00,United Kingdom,2021,26034,Finance,Business Services
SCOAU,ScION Tech Growth I Unit,$10.20,0.17,1.695%,0.00,United Kingdom,2020,1450,Finance,Business Services
SCOAW,ScION Tech Growth I Warrant,$1.12,0.0129,1.165%,0.00,United Kingdom,2021,32136,Finance,Business Services
SCOBU,ScION Tech Growth II Units,$9.95,-0.08,-0.798%,0.00,United Kingdom,2021,23164,Finance,Business Services
SCOR,comScore Inc. Common Stock,$3.635,-0.035,-0.954%,291892568.00,United States,2018,288055,Miscellaneous,Business Services
SCPH,scPharmaceuticals Inc. Common Stock,$6.68,0.04,0.602%,182497326.00,United States,2017,17965,Health Care,Major Pharmaceuticals
SCPL,SciPlay Corporation Class A Common Stock,$15.15,0.54,3.696%,346354649.00,United States,2019,383174,Technology,EDP Services
SCPS,Scopus BioPharma Inc. Common Stock,$8.8843,-0.2857,-3.116%,129511745.00,United States,2020,21395,Health Care,Major Pharmaceuticals
SCR,Score Media and Gaming Inc. Class A Subordinate Voting Shares,$24.32,-0.64,-2.564%,1224344800.00,Canada,,271471,Consumer Services,Services-Misc. Amusement & Recreation
SCSC,ScanSource Inc. Common Stock,$31.48,0.34,1.092%,801221594.00,United States,,44316,Technology,Retail: Computer Software & Peripheral Equipment
SCVL,Shoe Carnival Inc. Common Stock,$59.165,1.955,3.417%,834437719.00,United States,1993,142099,Consumer Services,Clothing/Shoe/Accessory Stores
SCWX,SecureWorks Corp. Class A Common Stock,$13.40,-0.04,-0.298%,1112592071.00,United States,2016,47187,Technology,Computer Software: Prepackaged Software
SCYX,SCYNEXIS Inc. Common Stock,$7.63,-0.46,-5.686%,147107308.00,United States,2014,245631,Health Care,Major Pharmaceuticals
SDACU,Sustainable Development Acquisition I Corp. Unit,$10.05,0.07,0.701%,0.00,United States,2021,37067,Finance,Business Services
SDC,SmileDirectClub Inc. Class A Common Stock,$10.33,-0.27,-2.547%,3997112234.00,United States,2019,2560690,Health Care,Medical/Dental Instruments
SDGR,Schrodinger Inc. Common Stock,$70.14,0.71,1.023%,4910661740.00,United States,2020,662061,Health Care,Major Pharmaceuticals
SDH,Global Internet of People Inc. Ordinary Shares,$3.82,-0.09,-2.302%,89846400.00,China,2021,220823,Miscellaneous,Business Services
SEAC,SeaChange International Inc. Common Stock,$1.015,-0.045,-4.245%,38203894.00,United States,1996,768886,Technology,Radio And Television Broadcasting And Communications Equipment
SECO,Secoo Holding Limited ADR,$2.57,0.01,0.391%,181577084.00,China,2017,246480,Consumer Services,Other Specialty Stores
SEDG,SolarEdge Technologies Inc. Common Stock,$270.55,0.52,0.193%,13955390787.00,Israel,2015,440923,Technology,Semiconductors
SEED,Origin Agritech Limited Common Stock,$20.90,-2.16,-9.367%,118838926.00,China,,166037,Consumer Non-Durables,Farming/Seeds/Milling
SEEL,Seelos Therapeutics Inc. Common Stock,$4.295,-0.235,-5.188%,314606834.00,United States,,3937114,Health Care,Major Pharmaceuticals
SEER,Seer Inc. Class A Common Stock,$40.0001,-1.7399,-4.168%,2436448131.00,United States,2020,642548,Capital Goods,Biotechnology: Laboratory Analytical Instruments
SEIC,SEI Investments Company Common Stock,$60.70,0.94,1.573%,8711461869.00,United States,1981,126407,Finance,Investment Bankers/Brokers/Service
SELB,Selecta Biosciences Inc. Common Stock,$4.149,-0.241,-5.49%,466236403.00,United States,2016,703575,Health Care,Major Pharmaceuticals
SELF,Global Self Storage Inc. Common Stock,$4.66,0.15,3.326%,43599901.00,United States,,10777,Consumer Services,Real Estate Investment Trusts
SENEA,Seneca Foods Corp. Class A Common Stock,$50.185,-0.305,-0.604%,455087015.00,United States,,29579,Consumer Non-Durables,Packaged Foods
SENEB,Seneca Foods Corp. Class B Common Stock,$50.37,0.00,0.00%,456764630.00,United States,,4,Consumer Non-Durables,Packaged Foods
SESN,Sesen Bio Inc. Common Stock,$2.705,-0.075,-2.698%,453300213.00,United States,2014,3317918,Health Care,Major Pharmaceuticals
SFBC,Sound Financial Bancorp Inc. Common Stock,$42.12,-0.51,-1.196%,109217160.00,United States,,1592,Finance,Savings Institutions
SFBS,ServisFirst Bancshares Inc. Common Stock,$63.11,1.18,1.905%,3414188142.00,United States,2014,107018,Finance,Major Banks
SFET,Safe-T Group Ltd. American Depositary Share,$1.4211,0.0011,0.077%,37118960.00,Israel,2018,968390,Technology,Computer Software: Prepackaged Software
SFIX,Stitch Fix Inc. Class A Common Stock,$47.69,0.16,0.337%,5071622904.00,United States,2017,1284996,Consumer Services,Catalog/Specialty Distribution
SFM,Sprouts Farmers Market Inc. Common Stock,$27.80,1.50,5.703%,3279105493.00,United States,2013,2736310,Consumer Services,Food Chains
SFNC,Simmons First National Corporation Class A Common Stock,$30.575,0.565,1.883%,3304763388.00,United States,,240068,Finance,Major Banks
SFST,Southern First Bancshares Inc. Common Stock,$47.50,0.85,1.822%,370362155.00,United States,,7699,Finance,Major Banks
SFT,Shift Technologies Inc. Class A Common Stock,$8.2501,-0.1599,-1.901%,693737189.00,United States,2019,475385,Consumer Durables,Automotive Aftermarket
SGA,Saga Communications Inc. Class A Common Stock (FL),$23.24,-0.60,-2.517%,138984333.00,United States,,29653,Consumer Services,Broadcasting
SGAM,Seaport Global Acquisition Corp. Class A Common Stock,$9.88,0.14,1.437%,177531250.00,United States,2020,95948,Finance,Business Services
SGAMU,Seaport Global Acquisition Corp. Unit,$10.25,0.15,1.485%,0.00,United States,2020,9862,Finance,Business Services
SGAMW,Seaport Global Acquisition Corp. Warrant,$0.634,-0.023,-3.501%,0.00,United States,2020,28943,Finance,Business Services
SGBX,SG Blocks Inc. Common Stock,$4.17,0.01,0.24%,36772265.00,United States,2017,189323,Consumer Services,RETAIL: Building Materials
SGC,Superior Group of Companies Inc. Common Stock,$24.3976,0.4176,1.741%,379218069.00,United States,,17660,Consumer Non-Durables,Apparel
SGEN,Seagen Inc. Common Stock,$137.76,-1.52,-1.091%,24957214081.00,United States,2001,740758,Health Care,Biotechnology: Biological Products (No Diagnostic Substances)
SGH,SMART Global Holdings Inc. Ordinary Shares,$43.77,0.70,1.625%,1036148301.00,United States,2017,165003,Technology,Semiconductors
SGLB,Sigma Labs Inc. Common Stock,$4.18,-0.15,-3.464%,24369400.00,United States,,331893,Consumer Durables,Miscellaneous manufacturing industries
SGLBW,Sigma Labs Inc. Warrant,$0.39,-0.01,-2.50%,0.00,United States,,4802,Consumer Durables,Miscellaneous manufacturing industries
SGMA,SigmaTron International Inc. Common Stock,$5.50,0.11,2.041%,23416294.00,United States,1994,6628,Technology,Electrical Products
SGMO,Sangamo Therapeutics Inc. Common Stock,$11.91,-0.36,-2.934%,1706122304.00,United States,2000,631751,Health Care,Biotechnology: Biological Products (No Diagnostic Substances)
SGMS,Scientific Games Corp Common Stock,$37.89,-2.77,-6.813%,3614323235.00,United States,,428082,Technology,EDP Services
SGOC,SGOCO Group Ltd Ordinary Shares (Cayman Islands),$1.97,0.10,5.348%,198179335.00,China,2010,134043,Technology,Radio And Television Broadcasting And Communications Equipment
