Symbol,Name,Last Sale,Net Change,% Change,Market Cap,Country,IPO Year,Volume,Sector,Industry
AACG,ATA Creativity Global American Depositary Shares,$4.77,0.80,20.151%,149541890.00,China,,5414129,Consumer Services,Other Consumer Services
AACQ,Artius Acquisition Inc. Class A Common Stock,$10.20,0.13,1.291%,923737500.00,United States,2020,1237305,Basic Industries,Major Chemicals
AACQU,Artius Acquisition Inc. Unit ,$10.63,0.09,0.854%,0.00,United States,2020,1562,Basic Industries,Major Chemicals
AACQW,Artius Acquisition Inc Warrant,$1.82,-0.04,-2.151%,0.00,United States,2020,116442,Basic Industries,Major Chemicals
AAL,American Airlines Group Inc. Common Stock,$22.805,0.035,0.154%,14587806619.00,United States,,30759320,Transportation,Air Freight/Delivery Services
AAME,Atlantic American Corporation Common Stock,$3.66,-0.29,-7.342%,74716261.00,United States,,222176,Finance,Life Insurance
AAOI,Applied Optoelectronics Inc. Common Stock,$8.14,0.30,3.827%,217335175.00,United States,2013,416872,Technology,Semiconductors
AAON,AAON Inc. Common Stock,$71.76,0.93,1.313%,3752117703.00,United States,,88724,Capital Goods,Industrial Machinery/Components
AAPL,Apple Inc. Common Stock,$119.9336,-0.6564,-0.544%,2079329600624.00,United States,1980,70738733,Technology,Computer Manufacturing
AAWW,Atlas Air Worldwide Holdings NEW Common Stock,$57.45,1.91,3.439%,1654430565.00,United States,,310147,Transportation,Transportation Services
ABCB,Ameris Bancorp Common Stock,$53.72,1.04,1.974%,3739931230.00,United States,1994,388216,Finance,Major Banks
ABCL,AbCellera Biologics Inc. Common Shares,$24.425,-2.155,-8.108%,6574911233.00,Canada,2020,1452136,Health Care,Major Pharmaceuticals
ABCM,Abcam plc American Depositary Shares,$19.7899,0.0299,0.151%,4486763140.00,United Kingdom,2020,25917,Health Care,Biotechnology: Biological Products (No Diagnostic Substances)
ABEO,Abeona Therapeutics Inc. Common Stock,$1.785,-0.095,-5.053%,171595045.00,United States,,1632747,Health Care,Major Pharmaceuticals
ABGI,ABG Acquisition Corp. I Class A Ordinary Shares,$9.80,0.06,0.616%,189458990.00,United States,2021,686,Finance,Business Services
ABIO,ARCA biopharma Inc. Common Stock,$3.6778,-0.1222,-3.216%,52997624.00,United States,,327450,Health Care,Biotechnology: In Vitro & In Vivo Diagnostic Substances
ABMD,ABIOMED Inc. Common Stock,$297.16,3.02,1.027%,13440833857.00,United States,,137335,Health Care,Medical/Dental Instruments
ABNB,Airbnb Inc. Class A Common Stock,$172.21,-3.95,-2.242%,102705872995.00,United States,2020,2914689,Finance,Diversified Commercial Services
ABST,Absolute Software Corporation Common Stock,$13.43,-0.25,-1.827%,659638047.00,Canada,2020,24793,Technology,Computer Software: Prepackaged Software
ABTX,Allegiance Bancshares Inc. Common Stock,$41.27,0.70,1.725%,832290769.00,United States,2015,26790,Finance,Major Banks
ABUS,Arbutus Biopharma Corporation Common Stock,$3.3101,-0.0399,-1.191%,320245273.00,Canada,,737137,Health Care,Major Pharmaceuticals
ACAC,Acies Acquisition Corp. Class A Ordinary Share,$9.90,-0.03,-0.302%,266371875.00,United States,2020,45799,Technology,Computer Software: Prepackaged Software
ACACU,Acies Acquisition Corp. Unit,$10.20,0.00,0.00%,0.00,United States,2020,46,Technology,Computer Software: Prepackaged Software
ACACW,Acies Acquisition Corp. Warrant,$1.75,0.27,18.243%,0.00,United States,2020,53091,Technology,Computer Software: Prepackaged Software
ACAD,ACADIA Pharmaceuticals Inc. Common Stock,$25.66,-0.36,-1.384%,4106818080.00,United States,1985,1045858,Health Care,Major Pharmaceuticals
ACAHU,Atlantic Coastal Acquisition Corp. Unit,$9.92,0.08,0.813%,0.00,United States,2021,165280,Finance,Business Services
ACBI,Atlantic Capital Bancshares Inc. Common Stock,$24.33,0.47,1.97%,495663095.00,United States,,31941,Finance,Major Banks
ACCD,Accolade Inc. Common Stock,$41.21,0.43,1.054%,2396090379.00,United States,2020,739932,,
ACER,Acer Therapeutics Inc. Common Stock (DE),$2.9596,-0.1804,-5.745%,42352598.00,United States,,328253,Health Care,Major Pharmaceuticals
ACET,Adicet Bio Inc. Common Stock ,$12.93,-0.07,-0.538%,253296476.00,United States,2018,49029,Health Care,Major Pharmaceuticals
ACEV,ACE Convergence Acquisition Corp. Class A Ordinary Shares,$9.98,0.04,0.402%,286925000.00,United States,2020,203051,Technology,Semiconductors
ACEVU,ACE Convergence Acquisition Corp. Unit,$10.89,0.02,0.184%,0.00,United States,2020,300,Technology,Semiconductors
ACEVW,ACE Convergence Acquisition Corp. Warrant,$1.875,0.005,0.267%,0.00,United States,2020,34877,Technology,Semiconductors
ACGL,Arch Capital Group Ltd. Common Stock,$38.47,0.26,0.68%,15503968392.00,Bermuda,,749194,Finance,Property-Casualty Insurers
ACGLO,Arch Capital Group Ltd. Depositary Shares Each Representing 1/1000th Interest in a Share of 5.45% Non-Cumulative Preferred Shares Series F,$26.365,-0.085,-0.321%,0.00,Bermuda,,8070,Finance,Property-Casualty Insurers
ACGLP,Arch Capital Group Ltd. Depositary Shares Representing Interest in 5.25% Non-Cumulative Preferred Series E Shrs,$25.57,-0.13,-0.506%,0.00,Bermuda,,20426,Finance,Property-Casualty Insurers
ACHC,Acadia Healthcare Company Inc. Common Stock,$57.32,-0.08,-0.139%,5103769705.00,United States,,271990,Health Care,Medical Specialities
ACHV,Achieve Life Sciences Inc. Common Shares,$11.73,-0.24,-2.005%,72138526.00,United States,,25133,Health Care,Biotechnology: In Vitro & In Vivo Diagnostic Substances
ACIU,AC Immune SA Common Stock,$7.55,-0.21,-2.706%,541646702.00,Switzerland,2016,110782,Health Care,Major Pharmaceuticals
ACIW,ACI Worldwide Inc. Common Stock,$37.63,0.175,0.467%,4408074420.00,United States,,545782,Technology,Computer Software: Prepackaged Software
ACKIT,Ackrell SPAC Partners I Co. Subunits,$9.9753,0.0953,0.965%,0.00,United States,2021,54063,Finance,Business Services
ACKIU,Ackrell SPAC Partners I Co. Units,$10.1856,0.0756,0.748%,0.00,United States,2020,2860,Finance,Business Services
ACKIW,Ackrell SPAC Partners I Co. Warrants,$0.60,0.06,11.111%,0.00,United States,2021,33063,Finance,Business Services
ACLS,Axcelis Technologies Inc. Common Stock,$38.813,1.753,4.73%,1309243570.00,United States,2000,260990,Technology,Industrial Machinery/Components
ACMR,ACM Research Inc. Class A Common Stock,$81.76,-2.24,-2.667%,1532430460.00,United States,2017,165221,Technology,Industrial Machinery/Components
ACNB,ACNB Corporation Common Stock,$31.05,0.33,1.074%,270426653.00,United States,,2728,Finance,Major Banks
ACOR,Acorda Therapeutics Inc. Common Stock,$4.9499,-0.1501,-2.943%,46973922.00,United States,2006,69514,Health Care,Biotechnology: Biological Products (No Diagnostic Substances)
ACQRU,Independence Holdings Corp. Units,$10.025,0.085,0.855%,0.00,United States,2021,80696,Finance,Business Services
ACRS,Aclaris Therapeutics Inc. Common Stock,$22.90,-1.07,-4.464%,1186317508.00,United States,2015,488296,Health Care,Major Pharmaceuticals
ACRX,AcelRx Pharmaceuticals Inc. Common Stock,$1.645,-0.035,-2.083%,195669180.00,United States,2011,1205966,Health Care,Major Pharmaceuticals
ACST,Acasti Pharma Inc. Class A Common Stock,$0.6135,-0.0118,-1.887%,59443571.00,Canada,,6255131,Health Care,Major Pharmaceuticals
ACTC,ArcLight Clean Transition Corp. Class A Ordinary Shares,$16.00,-0.22,-1.356%,555000000.00,United States,2020,725908,Capital Goods,Auto Manufacturing
ACTCU,ArcLight Clean Transition Corp. Unit,$18.16,-0.64,-3.404%,0.00,United States,2020,1666,Capital Goods,Auto Manufacturing
ACTCW,ArcLight Clean Transition Corp. Warrant,$4.805,-0.085,-1.738%,0.00,United States,2020,97142,Capital Goods,Auto Manufacturing
ACTDU,ArcLight Clean Transition Corp. II Unit,$10.05,0.06,0.601%,0.00,United States,2021,137764,Finance,Business Services
ACTG,Acacia Research Corporation (Acacia Tech) Common Stock,$5.89,-0.165,-2.725%,290255978.00,United States,,637153,Miscellaneous,Multi-Sector Companies
ACVA,ACV Auctions Inc. Class A Common Stock,$29.605,-0.395,-1.317%,0.00,United States,2021,812980,,
ADAG,Adagene Inc. American Depositary Shares,$17.625,-0.085,-0.48%,743419328.00,China,2021,11677,Health Care,Major Pharmaceuticals
ADAP,Adaptimmune Therapeutics plc American Depositary Shares,$5.00,-0.25,-4.762%,775689725.00,United Kingdom,2015,410013,Health Care,Biotechnology: Biological Products (No Diagnostic Substances)
ADBE,Adobe Inc. Common Stock,$462.53,11.54,2.559%,221702466068.00,United States,1986,2391834,Technology,Computer Software: Prepackaged Software
ADER,26 Capital Acquisition Corp. Class A Common Stock,$9.86,0.23,2.388%,338937500.00,United States,2021,14145,Finance,Business Services
ADERU,26 Capital Acquisition Corp. Unit,$10.14,0.14,1.40%,0.00,United States,2021,22509,Finance,Business Services
ADERW,26 Capital Acquisition Corp. Warrant,$0.77,0.01,1.316%,0.00,United States,2021,65836,Finance,Business Services
ADES,Advanced Emissions Solutions Inc. Common Stock,$5.49,0.00,0.00%,101668465.00,United States,,70496,Basic Industries,Major Chemicals
ADI,Analog Devices Inc. Common Stock,$154.87,4.97,3.316%,57209529647.00,United States,,2255817,Technology,Semiconductors
ADIL,Adial Pharmaceuticals Inc Common Stock,$2.34,-0.05,-2.092%,40411512.00,United States,2018,97856,Health Care,Major Pharmaceuticals
ADILW,Adial Pharmaceuticals Inc Warrant,$0.8069,0.197,32.30%,0.00,United States,2018,4324,Health Care,Major Pharmaceuticals
ADMA,ADMA Biologics Inc Common Stock,$1.81,-0.24,-11.707%,171131974.00,United States,,4931832,Health Care,Biotechnology: Biological Products (No Diagnostic Substances)
ADMP,Adamis Pharmaceuticals Corporation Common Stock,$0.9241,0.0038,0.413%,129632054.00,United States,,2063766,Health Care,Major Pharmaceuticals
ADMS,Adamas Pharmaceuticals Inc. Common Stock,$5.0494,-0.1406,-2.709%,226937310.00,United States,2014,69969,Health Care,Major Pharmaceuticals
ADN,Advent Technologies Holdings Inc. Class A Common Stock,$15.62,0.14,0.904%,319244809.00,United States,2018,589668,Miscellaneous,Industrial Machinery/Components
ADNWW,Advent Technologies Holdings Inc. Warrant,$3.09,0.18,6.186%,0.00,United States,2018,385385,Miscellaneous,Industrial Machinery/Components
ADOC,Edoc Acquisition Corp. Class A Ordinary Share,$10.00,0.05,0.503%,118040000.00,United States,2020,112988,Finance,Business Services
ADOCR,Edoc Acquisition Corp. Right,$0.44,0.065,17.333%,0.00,United States,2020,7982,Finance,Business Services
ADOCW,Edoc Acquisition Corp. Warrant,$0.3799,0.0049,1.307%,0.00,United States,2020,8672,Finance,Business Services
ADP,Automatic Data Processing Inc. Common Stock,$190.90,3.90,2.086%,81693787998.00,United States,,1260613,Technology,EDP Services
ADPT,Adaptive Biotechnologies Corporation Common Stock,$37.33,-1.35,-3.49%,5197064047.00,United States,2019,1066586,Health Care,Biotechnology: Biological Products (No Diagnostic Substances)
ADSK,Autodesk Inc. Common Stock,$265.37,3.18,1.213%,58273207059.00,United States,,1025601,Technology,Computer Software: Prepackaged Software
ADTN,ADTRAN Inc. Common Stock,$17.125,0.505,3.039%,827780732.00,United States,1994,166549,Public Utilities,Telecommunications Equipment
ADTX,ADiTx Therapeutics Inc. Common Stock,$2.86,-0.27,-8.626%,40043998.00,United States,2020,185797,Health Care,Major Pharmaceuticals
ADUS,Addus HomeCare Corporation Common Stock,$106.71,2.27,2.173%,1688822766.00,United States,2009,40086,Health Care,Medical/Nursing Services
ADV,Advantage Solutions Inc. Class A Common Stock,$11.84,-0.13,-1.086%,3770447597.00,United States,2019,191802,Miscellaneous,Business Services
ADVM,Adverum Biotechnologies Inc. Common Stock,$9.755,-0.455,-4.456%,954001229.00,United States,2014,386152,Health Care,Biotechnology: Biological Products (No Diagnostic Substances)
ADVWW,Advantage Solutions Inc. Warrant,$2.92,-0.08,-2.667%,0.00,United States,2019,6975,Miscellaneous,Business Services
ADXN,Addex Therapeutics Ltd American Depositary Shares,$10.353,0.223,2.201%,58757944.00,Switzerland,,4992,Health Care,Major Pharmaceuticals
ADXS,Advaxis Inc. Common Stock,$0.78,0.028,3.723%,93183964.00,United States,,3180001,Health Care,Major Pharmaceuticals
AEAC,Authentic Equity Acquisition Corp. Class A ordinary share,$9.68,0.04,0.415%,0.00,United States,2021,7546,Finance,Business Services
AEACU,Authentic Equity Acquisition Corp. Unit,$9.945,0.045,0.455%,0.00,United States,2021,22195,Finance,Business Services
AEACW,Authentic Equity Acquisition Corp. Warrant,$0.64,0.05,8.475%,0.00,United States,2021,221742,Finance,Business Services
AEGN,Aegion Corp Common Stock,$28.715,-0.435,-1.492%,882703120.00,United States,,179092,Basic Industries,Water Supply
AEHL,Antelope Enterprise Holdings Limited Common Stock (0.024 par),$3.20,-0.70,-17.949%,11828019.00,China,,909972,Capital Goods,Building Materials
AEHR,Aehr Test Systems Common Stock,$2.44,0.07,2.954%,57319328.00,United States,1997,43868,Capital Goods,Electrical Products
AEI,Alset EHome International Inc. Common Stock,$11.08,-0.38,-3.316%,94955600.00,United States,2020,1205300,Finance,Real Estate
AEIS,Advanced Energy Industries Inc. Common Stock,$109.57,7.49,7.337%,4204828188.00,United States,1995,139926,Capital Goods,Industrial Machinery/Components
AEMD,Aethlon Medical Inc. Common Stock,$2.02,-0.02,-0.98%,24505190.00,United States,,64441,Health Care,Medical/Dental Instruments
AEP,American Electric Power Company Inc. Common Stock,$84.45,-0.27,-0.319%,41943095597.00,United States,,1572814,Public Utilities,Electric Utilities: Central
AEPPL,American Electric Power Company Inc. Corporate Unit,$48.465,-0.035,-0.072%,0.00,United States,,12484,Public Utilities,Electric Utilities: Central
AEPPZ,American Electric Power Company Inc. Corporate Units,$49.16,0.16,0.327%,0.00,United States,,4710,Public Utilities,Electric Utilities: Central
AERI,Aerie Pharmaceuticals Inc. Common Stock,$17.51,-0.635,-3.50%,821518999.00,United States,2013,391209,Health Care,Biotechnology: Biological Products (No Diagnostic Substances)
AESE,Allied Esports Entertainment Inc. Common Stock,$2.765,-0.275,-9.046%,108220723.00,United States,2017,3195215,Consumer Services,Services-Misc. Amusement & Recreation
AEY,ADDvantage Technologies Group Inc. Common Stock,$2.61,0.02,0.772%,32276808.00,United States,,54350,Consumer Services,Office Equipment/Supplies/Services
AEYE,AudioEye Inc. Common Stock,$25.83,-1.66,-6.039%,276527818.00,United States,,99142,Technology,Computer Software: Prepackaged Software
AEZS,Aeterna Zentaris Inc. Common Stock,$1.20,0.03,2.564%,75214336.00,Canada,,31946471,Health Care,Major Pharmaceuticals
AFAQU,AF Acquisition Corp. Units,$9.80,-0.03,-0.305%,0.00,United States,2021,565164,Finance,Business Services
AFBI,Affinity Bancshares Inc. Common Stock (MD),$12.0529,-0.0571,-0.472%,0.00,United States,2017,2093,Finance,Savings Institutions
AFCG,AFC Gamma Inc. Common Stock,$21.00,0.70,3.448%,261017232.00,United States,2021,19519,Finance,Real Estate
AFIB,Acutus Medical Inc. Common Stock,$13.19,-0.57,-4.142%,370573103.00,United States,2020,267431,Health Care,Medical/Dental Instruments
AFIN,American Finance Trust Inc. Class A Common Stock,$9.86,0.18,1.86%,1073134881.00,United States,,220940,Consumer Services,Real Estate Investment Trusts
AFINO,American Finance Trust Inc. 7.375% Series C Cumulative Redeemable Preferred Stock,$25.04,0.0301,0.12%,,United States,,37013,Consumer Services,Real Estate Investment Trusts
AFINP,American Finance Trust Inc. 7.50% Series A Cumulative Redeemable Perpetual Preferred Stock,$25.81,0.11,0.428%,0.00,United States,,9137,Consumer Services,Real Estate Investment Trusts
AFMD,Affimed N.V.,$7.62,-0.355,-4.451%,874671926.00,Germany,2014,754941,Health Care,Major Pharmaceuticals
AFRM,Affirm Holdings Inc. Class A Common Stock,$68.86,-0.70,-1.006%,17725077076.00,United States,2021,1156737,Miscellaneous,Business Services
AFYA,Afya Limited Class A Common Shares,$18.94,-0.73,-3.711%,1765261468.00,Brazil,2019,145446,Consumer Services,Other Consumer Services
AGBA,AGBA Acquisition Limited Ordinary Share,$10.58,0.00,0.00%,63215500.00,Hong Kong,2019,125,Finance,Business Services
AGBAR,AGBA Acquisition Limited Right,$0.35,0.09,34.615%,0.00,Hong Kong,2019,174690,Finance,Business Services
AGBAU,AGBA Acquisition Limited Unit,$12.20,0.00,0.00%,0.00,Hong Kong,2019,33,Finance,Business Services
AGBAW,AGBA Acquisition Limited Warrant,$0.35,0.02,6.061%,0.00,Hong Kong,2019,14240,Finance,Business Services
AGC,Altimeter Growth Corp. Class A Ordinary Shares,$11.63,-0.42,-3.485%,726875000.00,United States,2020,313193,Finance,Business Services
AGCUU,Altimeter Growth Corp. Unit,$12.21,-0.53,-4.16%,0.00,United States,2020,11414,Finance,Business Services
AGCWW,Altimeter Growth Corp. Warrant,$3.50,-0.42,-10.714%,0.00,United States,2020,26428,Finance,Business Services
AGEN,Agenus Inc. Common Stock,$2.82,0.00,0.00%,577212890.00,United States,2000,2431411,Health Care,Biotechnology: Biological Products (No Diagnostic Substances)
AGFS,AgroFresh Solutions Inc. Common Stock,$2.12,0.00,0.00%,111174458.00,United States,2014,32094,Basic Industries,Agricultural Chemicals
AGFY,Agrify Corporation Common Stock,$11.60,-0.40,-3.333%,232636852.00,United States,2021,176036,Consumer Non-Durables,Farming/Seeds/Milling
AGGRU,Agile Growth Corp. Units,$9.94,0.16,1.636%,0.00,United States,2021,6500,Finance,Business Services
AGIO,Agios Pharmaceuticals Inc. Common Stock,$48.905,-0.475,-0.962%,3403853141.00,United States,2013,554994,Health Care,Major Pharmaceuticals
AGLE,Aeglea BioTherapeutics Inc. Common Stock,$7.55,-0.58,-7.134%,362519985.00,United States,2016,98456,Health Care,Major Pharmaceuticals
AGMH,AGM Group Holdings Inc. Class A Ordinary Shares,$11.72,-2.01,-14.639%,338603165.00,Hong Kong,2018,9416,Technology,EDP Services
AGNC,AGNC Investment Corp. Common Stock,$16.925,0.135,0.804%,8989242880.00,United States,2008,4135203,Consumer Services,Real Estate Investment Trusts
AGNCM,AGNC Investment Corp. Depositary Shares rep 6.875% Series D Fixed-to-Floating Cumulative Redeemable Preferred Stock,$25.7317,0.1417,0.554%,0.00,United States,,9585,Consumer Services,Real Estate Investment Trusts
AGNCN,AGNC Investment Corp. Depositary Shares Each Representing a 1/1000th Interest in a Share of 7.00% Series C Fixed-To-Floating Rate Cumulative Redeemable Preferred Stock,$25.9284,0.1085,0.42%,0.00,United States,,11374,Consumer Services,Real Estate Investment Trusts
AGNCO,AGNC Investment Corp. Depositary Shares each representing a 1/1000th interest in a share of 6.50% Series E Fixed-to-Floating Cumulative Redeemable Preferred Stock,$24.90,0.23,0.932%,0.00,United States,,81828,Consumer Services,Real Estate Investment Trusts
AGNCP,AGNC Investment Corp. Depositary Shares Each Representing a 1/1000th Interest in a Share of 6.125% Series F Fixed-to-Floating Rate Cumulative Redeemable Preferred Stock,$23.91,0.11,0.462%,0.00,United States,,177736,Consumer Services,Real Estate Investment Trusts
AGRX,Agile Therapeutics Inc. Common Stock,$2.02,-0.02,-0.98%,177010386.00,United States,2014,1089800,Health Care,Major Pharmaceuticals
AGTC,Applied Genetic Technologies Corporation Common Stock,$5.045,-0.225,-4.269%,215208995.00,United States,2014,819206,Health Care,Biotechnology: Biological Products (No Diagnostic Substances)
AGYS,Agilysys Inc. Common Stock,$47.43,-0.64,-1.331%,1121129091.00,United States,,166585,Technology,EDP Services
AHAC,Alpha Healthcare Acquisition Corp. Class A Common Stock,$10.55,-0.04,-0.378%,161995250.00,United States,2020,204469,Finance,Business Services
AHACU,Alpha Healthcare Acquisition Corp. Unit,$12.05,0.00,0.00%,0.00,United States,2020,52,Finance,Business Services
AHACW,Alpha Healthcare Acquisition Corp. Warrant,$2.83,-0.07,-2.414%,0.00,United States,2020,39406,Finance,Business Services
AHCO,AdaptHealth Corp. Class A Common Stock,$34.95,0.66,1.925%,4015699255.00,United States,2018,294259,Health Care,Medical/Nursing Services
AHPI,Allied Healthcare Products Inc. Common Stock,$4.5113,-0.1387,-2.983%,18106269.00,United States,1992,46969,Health Care,Industrial Specialties
AIH,Aesthetic Medical International Holdings Group Ltd. American Depositary Shares,$7.78,0.37,4.993%,183708284.00,China,2019,494739,Health Care,Medical Specialities
AIHS,Senmiao Technology Limited Common Stock,$1.4086,0.0786,5.91%,61075231.00,China,2018,966493,Finance,Finance: Consumer Services
AIKI,AIkido Pharma Inc. Common Stock,$1.1599,-0.0101,-0.863%,103094073.00,United States,,3241731,Health Care,Biotechnology: Commercial Physical & Biological Resarch
AIMC,Altra Industrial Motion Corp. Common Stock,$55.42,0.66,1.205%,3591617961.00,United States,2006,233424,Capital Goods,Industrial Machinery/Components
AINV,Apollo Investment Corporation Common Stock,$13.64,0.02,0.147%,890135161.00,United States,2004,170277,,
AIRG,Airgain Inc. Common Stock,$21.43,1.00,4.895%,221840638.00,United States,2016,88060,Technology,Radio And Television Broadcasting And Communications Equipment
AIRT,Air T Inc. Common Stock,$23.90,0.20,0.844%,68876287.00,United States,,1633,Transportation,Air Freight/Delivery Services
AIRTP,Air T Inc. Air T Funding Alpha Income Trust Preferred Securities,$25.00,0.10,0.402%,0.00,United States,,2100,Transportation,Air Freight/Delivery Services
AIRTW,Air T Inc. Air T Funding Warrants to Purchase Alpha Income Trust Preferred Expiring 08/30/2021,$0.2297,0.0076,3.422%,0.00,United States,,24258,Transportation,Air Freight/Delivery Services
AKAM,Akamai Technologies Inc. Common Stock,$101.62,2.08,2.09%,16586443837.00,United States,1999,1214033,Miscellaneous,Business Services
AKBA,Akebia Therapeutics Inc. Common Stock,$3.12,-0.12,-3.704%,478927597.00,United States,2014,2651034,Health Care,Major Pharmaceuticals
AKER,Akers Biosciences Inc. Common Stock,$3.29,-0.06,-1.791%,54787807.00,United States,2014,148752,Health Care,Biotechnology: In Vitro & In Vivo Diagnostic Substances
AKIC,Sports Ventures Acquisition Corp. Class A Ordinary Shares,$9.6909,0.1009,1.052%,285009369.00,United States,2021,4990,Finance,Business Services
AKICU,Sports Ventures Acquisition Corp. Unit,$9.92,0.05,0.507%,0.00,United States,2021,2307,Finance,Business Services
AKICW,Sports Ventures Acquisition Corp. Warrant,$0.8501,-0.0999,-10.516%,0.00,United States,2021,11475,Finance,Business Services
AKRO,Akero Therapeutics Inc. Common Stock,$28.82,-0.70,-2.371%,1002080594.00,United States,2019,140129,Health Care,Major Pharmaceuticals
AKTS,Akoustis Technologies Inc. Common Stock,$12.49,-0.31,-2.422%,590068492.00,United States,,538768,Public Utilities,Telecommunications Equipment
AKTX,Akari Therapeutics plc ADR (0.01 USD),$2.47,-0.15,-5.725%,95029098.00,United Kingdom,,99286,Health Care,Major Pharmaceuticals
AKU,Akumin Inc. Common Shares,$3.56,0.00,0.00%,249835204.00,Canada,,15824,Health Care,Medical Specialities
AKUS,Akouos Inc. Common Stock,$16.95,-0.96,-5.36%,582786172.00,United States,2020,68388,Health Care,Major Pharmaceuticals
ALAC,Alberton Acquisition Corporation Ordinary Shares,$10.91,0.01,0.092%,50352247.00,Hong Kong,2018,24249,Basic Industries,Engineering & Construction
ALACR,Alberton Acquisition Corporation Rights exp April 26 2021,$0.4305,0.0206,5.026%,0.00,Hong Kong,2018,5454,Basic Industries,Engineering & Construction
ALACW,Alberton Acquisition Corporation Warrant,$0.4266,-0.0222,-4.947%,0.00,Hong Kong,2018,195377,Basic Industries,Engineering & Construction
ALBO,Albireo Pharma Inc. Common Stock,$34.61,0.91,2.70%,661521800.00,United States,,135012,Health Care,Major Pharmaceuticals
ALCO,Alico Inc. Common Stock,$29.705,0.425,1.452%,223185933.00,United States,,11111,Consumer Non-Durables,Farming/Seeds/Milling
ALDX,Aldeyra Therapeutics Inc. Common Stock,$10.91,-0.43,-3.792%,515463101.00,United States,2014,292408,Health Care,Major Pharmaceuticals
ALEC,Alector Inc. Common Stock,$16.35,0.46,2.895%,1301205627.00,United States,2019,461865,Health Care,Biotechnology: Biological Products (No Diagnostic Substances)
ALGM,Allegro MicroSystems Inc. Common Stock,$24.905,0.475,1.944%,4717847394.00,United States,2020,540859,Technology,Semiconductors
ALGN,Align Technology Inc. Common Stock,$516.86,-1.01,-0.195%,40900539210.00,United States,2001,320336,Health Care,Industrial Specialties
ALGS,Aligos Therapeutics Inc. Common Stock,$18.80,-1.36,-6.746%,716616708.00,United States,2020,33955,Health Care,Biotechnology: Biological Products (No Diagnostic Substances)
ALGT,Allegiant Travel Company Common Stock,$248.31,1.30,0.526%,4076246283.00,United States,2006,69504,Transportation,Air Freight/Delivery Services
ALHC,Alignment Healthcare Inc. Common Stock,$17.24,-0.76,-4.222%,3228600002.00,United States,,4368449,,
ALIM,Alimera Sciences Inc. Common Stock,$9.56,-0.15,-1.545%,55002829.00,United States,2010,73781,Health Care,Major Pharmaceuticals
ALJJ,ALJ Regional Holdings Inc. Common Stock,$1.43,-0.02,-1.379%,60519099.00,United States,,87776,Miscellaneous,Business Services
ALKS,Alkermes plc Ordinary Shares,$19.24,-0.56,-2.828%,3063736984.00,Ireland,1991,522803,Health Care,Major Pharmaceuticals
ALLK,Allakos Inc. Common Stock,$113.21,0.99,0.882%,6013422439.00,United States,2018,168930,Health Care,Major Pharmaceuticals
ALLO,Allogene Therapeutics Inc. Common Stock,$33.463,-1.017,-2.95%,4706497934.00,United States,2018,207228,Health Care,Biotechnology: Biological Products (No Diagnostic Substances)
ALLT,Allot Ltd. Ordinary Shares,$15.02,0.40,2.736%,535061155.00,Israel,2006,85182,Technology,Computer Communications Equipment
ALNA,Allena Pharmaceuticals Inc. Common Stock,$1.41,-0.08,-5.369%,80200347.00,United States,2017,922244,Health Care,Biotechnology: Biological Products (No Diagnostic Substances)
ALNY,Alnylam Pharmaceuticals Inc. Common Stock,$134.35,-0.89,-0.658%,15719221253.00,United States,2004,161323,Health Care,Major Pharmaceuticals
ALOT,AstroNova Inc. Common Stock,$14.37,-0.38,-2.576%,103039884.00,United States,1983,10875,Technology,Computer peripheral equipment
ALPN,Alpine Immune Sciences Inc. Common Stock,$10.89,-0.11,-1.00%,260076483.00,United States,2015,31946,Health Care,Major Pharmaceuticals
