Symbol,Name,Last Sale,Net Change,% Change,Market Cap,Country,IPO Year,Volume,Sector,Industry
CTIB,Yunhong CTI Ltd. Common Stock,$2.28,-0.03,-1.299%,13186713.00,United States,1997,276921,Basic Industries,Specialty Chemicals
CTIC,CTI BioPharma Corp. (DE) Common Stock,$2.746,-0.054,-1.929%,210583414.00,United States,1997,353450,Health Care,Major Pharmaceuticals
CTMX,CytomX Therapeutics Inc. Common Stock,$7.615,-0.325,-4.093%,493332863.00,United States,2015,434112,Health Care,Major Pharmaceuticals
CTRE,CareTrust REIT Inc. Common Stock,$23.52,0.10,0.427%,2258504002.00,United States,,237407,Consumer Services,Real Estate Investment Trusts
CTRM,Castor Maritime Inc. Common Shares,$0.7966,-0.0315,-3.804%,405678409.00,Cyprus,,33789553,Transportation,Marine Transportation
CTRN,Citi Trends Inc. Common Stock,$84.72,1.10,1.315%,858972861.00,United States,2005,149239,Consumer Services,Clothing/Shoe/Accessory Stores
CTSH,Cognizant Technology Solutions Corporation Class A Common Stock,$78.49,1.39,1.803%,41647913110.00,United States,1998,1327590,Technology,EDP Services
CTSO,Cytosorbents Corporation Common Stock,$8.37,-0.28,-3.237%,361231447.00,United States,,117450,Health Care,Medical/Dental Instruments
CTXR,Citius Pharmaceuticals Inc. Common Stock,$1.90,-0.03,-1.554%,238991673.00,United States,,6225968,Health Care,Major Pharmaceuticals
CTXRW,Citius Pharmaceuticals Inc. Warrant,$0.80,0.00,0.00%,0.00,United States,,199,Health Care,Major Pharmaceuticals
CTXS,Citrix Systems Inc. Common Stock,$135.135,0.045,0.033%,16616703248.00,United States,1995,623475,Technology,Computer Software: Prepackaged Software
CUBA,Herzfeld Caribbean Basin Fund Inc. (The) Common Stock,$5.86,0.01,0.171%,35943277.00,United States,,4892,,
CUE,Cue Biopharma Inc. Common Stock,$11.48,-0.80,-6.515%,349649230.00,United States,2018,155782,Health Care,Major Pharmaceuticals
CUEN,Cuentas Inc. Common Stock,$3.47,-0.15,-4.144%,46652488.00,United States,,96007,Consumer Non-Durables,Food Distributors
CUENW,Cuentas Inc. Warrant,$0.9299,0.00,0.00%,0.00,United States,,2215,Consumer Non-Durables,Food Distributors
CURI,CuriosityStream Inc. Class A Common Stock,$13.86,-0.84,-5.714%,662251299.00,United States,2020,666609,Consumer Services,Movies/Entertainment
CURIW,CuriosityStream Inc. Warrant,$5.1877,-0.4423,-7.856%,0.00,United States,2020,19599,Consumer Services,Movies/Entertainment
CUTR,Cutera Inc. Common Stock,$28.215,-1.125,-3.834%,497505192.00,United States,2004,91662,Health Care,Biotechnology: Electromedical & Electrotherapeutic Apparatus
CVAC,CureVac N.V. Ordinary Shares,$84.84,0.12,0.142%,15857739643.00,Germany,2020,588052,Health Care,Major Pharmaceuticals
CVBF,CVB Financial Corporation Common Stock,$22.87,0.41,1.825%,3101183458.00,United States,,274841,Finance,Major Banks
CVCO,Cavco Industries Inc. Common Stock When Issued,$229.80,3.91,1.731%,2112376063.00,United States,,15353,Basic Industries,Homebuilding
CVCY,Central Valley Community Bancorp Common Stock,$19.06,0.13,0.687%,238712377.00,United States,,18633,Finance,Major Banks
CVET,Covetrus Inc. Common Stock,$30.18,-0.36,-1.179%,4111273186.00,United States,,233680,Health Care,Medical/Nursing Services
CVGI,Commercial Vehicle Group Inc. Common Stock,$10.055,0.165,1.668%,326918899.00,United States,2004,201753,Capital Goods,Auto Parts:O.E.M.
CVGW,Calavo Growers Inc. Common Stock,$77.18,1.40,1.847%,1366086000.00,United States,,66976,Consumer Non-Durables,Farming/Seeds/Milling
CVLG,Covenant Logistics Group Inc. Class A Common Stock,$19.72,0.46,2.388%,331296039.00,United States,,90178,Transportation,Trucking Freight/Courier Services
CVLT,Commvault Systems Inc. Common Stock,$64.49,0.94,1.479%,3030876256.00,United States,2006,154800,Technology,Computer Software: Prepackaged Software
CVLY,Codorus Valley Bancorp Inc Common Stock,$18.34,-0.01,-0.054%,180465435.00,United States,,3109,Finance,Savings Institutions
CVV,CVD Equipment Corporation Common Stock,$4.41,-0.08,-1.782%,29319876.00,United States,,5641,Technology,Industrial Machinery/Components
CWBC,Community West Bancshares Common Stock,$13.039,-0.1705,-1.291%,110871438.00,United States,,3212,Finance,Major Banks
CWBR,CohBar Inc. Common Stock,$1.35,-0.02,-1.46%,82508657.00,United States,,199389,Health Care,Major Pharmaceuticals
CWCO,Consolidated Water Co. Ltd. Ordinary Shares,$13.68,0.27,2.013%,206882298.00,Cayman Islands,,60769,Public Utilities,Water Supply
CWST,Casella Waste Systems Inc. Class A Common Stock,$65.70,0.83,1.279%,3356583501.00,United States,1997,78316,Public Utilities,Environmental Services
CXDC,China XD Plastics Company Limited Common Stock,$1.0709,-0.0091,-0.843%,75550754.00,China,,120339,Capital Goods,Containers/Packaging
CXDO,Crexendo Inc. Common Stock,$6.44,0.09,1.417%,118474085.00,United States,,7744,Public Utilities,Telecommunications Equipment
CYAD,Celyad Oncology SA American Depositary Shares,$7.2112,-0.0888,-1.216%,102436221.00,Belgium,2015,7143,Health Care,Major Pharmaceuticals
CYAN,Cyanotech Corporation Common Stock,$3.1799,-0.0401,-1.245%,19388082.00,United States,,10946,Consumer Durables,Specialty Chemicals
CYBE,CyberOptics Corporation Common Stock,$24.18,-0.39,-1.587%,176462424.00,United States,1987,50767,Capital Goods,Electronic Components
CYBR,CyberArk Software Ltd. Ordinary Shares,$131.19,0.32,0.245%,5128020577.00,Israel,2014,266374,Technology,Computer Software: Prepackaged Software
CYCC,Cyclacel Pharmaceuticals Inc. Common Stock,$7.2245,-0.2055,-2.766%,66334376.00,United States,,97038,Health Care,Major Pharmaceuticals
CYCCP,Cyclacel Pharmaceuticals Inc. 6% Convertible Preferred Stock,$6.8583,0.00,0.00%,0.00,United States,,5,Health Care,Major Pharmaceuticals
CYCN,Cyclerion Therapeutics Inc. Common Stock,$3.15,-0.33,-9.483%,107272318.00,United States,,145163,Health Care,Major Pharmaceuticals
CYRN,CYREN Ltd. Ordinary Shares,$0.8498,-0.0202,-2.322%,63512137.00,United States,,447537,Technology,Computer Software: Prepackaged Software
CYRX,CryoPort Inc. Common Stock,$50.85,0.55,1.093%,2318994825.00,United States,,274535,Health Care,Major Pharmaceuticals
CYTH,Cyclo Therapeutics Inc. Common Stock,$8.13,-0.87,-9.667%,51161667.00,United States,,806642,Basic Industries,Major Chemicals
CYTHW,Cyclo Therapeutics Inc. Warrant,$3.50,-0.89,-20.273%,0.00,United States,,11541,Basic Industries,Major Chemicals
CYTK,Cytokinetics Incorporated Common Stock,$23.595,-0.405,-1.688%,1677854041.00,United States,2004,298684,Health Care,Major Pharmaceuticals
CZNC,Citizens & Northern Corp Common Stock,$23.55,0.09,0.384%,376822325.00,United States,,21186,Finance,Major Banks
CZR,Caesars Entertainment Inc. Common Stock,$86.62,-0.32,-0.368%,18040991333.00,United States,,1812704,Consumer Services,Hotels/Resorts
CZWI,Citizens Community Bancorp Inc. Common Stock,$12.76,-0.12,-0.932%,139088364.00,United States,,861,Finance,Savings Institutions
DADA,Dada Nexus Limited American Depositary Shares,$25.22,-1.06,-4.033%,5935843410.00,China,2020,1530522,Technology,Computer Software: Programming Data Processing
DAIO,Data I/O Corporation Common Stock,$5.30,0.00,0.00%,44606576.00,United States,1981,3047,Capital Goods,Electrical Products
DAKT,Daktronics Inc. Common Stock,$6.10,0.15,2.521%,274294924.00,United States,1994,84304,Consumer Durables,Miscellaneous manufacturing industries
DARE,Dare Bioscience Inc. Common Stock,$1.75,-0.05,-2.778%,72793443.00,United States,2014,694345,Health Care,Major Pharmaceuticals
DBDR,Roman DBDR Tech Acquisition Corp. Class A Common Stock,$10.015,0.095,0.958%,289884175.00,United States,2020,45297,Finance,Business Services
DBDRU,Roman DBDR Tech Acquisition Corp. Unit,$10.2138,-0.0756,-0.735%,0.00,United States,2020,700,Finance,Business Services
DBDRW,Roman DBDR Tech Acquisition Corp. Warrant,$0.85,0.00,0.00%,0.00,United States,2020,44742,Finance,Business Services
DBTX,Decibel Therapeutics Inc. Common Stock,$11.47,-0.76,-6.214%,278739088.00,United States,2021,117323,Health Care,Major Pharmaceuticals
DBVT,DBV Technologies S.A. American Depositary Shares,$5.24,-0.07,-1.318%,575736480.00,France,2014,67320,Health Care,Biotechnology: Biological Products (No Diagnostic Substances)
DBX,Dropbox Inc. Class A Common Stock,$26.265,-0.085,-0.323%,10892540771.00,United States,2018,5648613,Technology,Computer Software: Prepackaged Software
DCBO,Docebo Inc. Common Shares,$40.25,1.24,3.179%,1315749075.00,Canada,,115368,Technology,Computer Software: Prepackaged Software
DCOM,Dime Community Bancshares Inc. Common Stock,$30.555,0.125,0.411%,1267674243.00,United States,,41532,Finance,Savings Institutions
DCOMP,Dime Community Bancshares Inc. Fixed-Rate Non-Cumulative Perpetual Preferred Stock Series A,$25.25,0.00,0.00%,0.00,United States,,3058,Finance,Major Banks
DCPH,Deciphera Pharmaceuticals Inc. Common Stock,$43.14,-0.55,-1.259%,2485983181.00,United States,2017,182970,Health Care,Major Pharmaceuticals
DCRB,Decarbonization Plus Acquisition Corporation Class A Common Stock,$10.44,0.15,1.458%,294571146.00,United States,2020,506057,Finance,Business Services
DCRBU,Decarbonization Plus Acquisition Corporation Unit,$11.1038,-0.0762,-0.682%,0.00,United States,2020,3967,Finance,Business Services
DCRBW,Decarbonization Plus Acquisition Corporation Warrant,$1.86,0.06,3.333%,0.00,United States,2020,81175,Finance,Business Services
DCRCU,Decarbonization Plus Acquisition Corporation III Unit,$9.99,0.14,1.421%,0.00,United States,2021,755253,,
DCRNU,Decarbonization Plus Acquisition Corporation II Unit,$10.00,0.10,1.01%,0.00,United States,2021,229038,Finance,Business Services
DCT,Duck Creek Technologies Inc. Common Stock,$42.97,0.15,0.35%,5630130156.00,United States,2020,204733,Technology,Computer Software: Prepackaged Software
DCTH,Delcath Systems Inc. Common Stock,$16.80,-0.02,-0.119%,104988358.00,United States,,42385,Health Care,Medical/Dental Instruments
DDMX,DD3 Acquisition Corp. II Class A Common Stock,$9.88,0.00,0.00%,71365216.00,Mexico,2021,5,Finance,Business Services
DDMXU,DD3 Acquisition Corp. II Unit,$10.23,-0.07,-0.68%,0.00,Mexico,2020,161,Finance,Business Services
DDMXW,DD3 Acquisition Corp. II Warrant,$1.21,0.1099,9.99%,0.00,Mexico,2021,1365,Finance,Business Services
DDOG,Datadog Inc. Class A Common Stock,$79.60,1.34,1.712%,24396745290.00,United States,2019,5051954,Technology,Computer Software: Prepackaged Software
DENN,Denny's Corporation Common Stock,$18.98,0.63,3.433%,1217469158.00,United States,,545777,Consumer Services,Restaurants
DFFN,Diffusion Pharmaceuticals Inc. Common Stock,$0.9096,-0.0475,-4.963%,92691859.00,United States,,1651006,Health Care,Major Pharmaceuticals
DFH,Dream Finders Homes Inc. Class A Common Stock,$22.89,1.01,4.616%,2117816723.00,United States,2021,87506,Capital Goods,Homebuilding
DFHT,Deerfield Healthcare Technology Acquisitions Corp. Class A Common Stock,$13.08,-0.45,-3.326%,235031250.00,United States,2020,29611,Health Care,Hospital/Nursing Management
DFHTU,Deerfield Healthcare Technology Acquisitions Corp. Unit,$13.05,-1.45,-10.00%,0.00,United States,2020,474,Health Care,Hospital/Nursing Management
DFHTW,Deerfield Healthcare Technology Acquisitions Corp. Warrant,$2.51,-0.59,-19.032%,0.00,United States,2020,6044,Health Care,Hospital/Nursing Management
DFPH,DFP Healthcare Acquisitions Corp. Class A Common Stock,$9.91,-0.09,-0.90%,284912500.00,United States,2020,230205,Finance,Business Services
DFPHU,DFP Healthcare Acquisitions Corp. Unit,$10.31,-0.34,-3.192%,0.00,United States,2020,200,Finance,Business Services
DFPHW,DFP Healthcare Acquisitions Corp. Warrant,$1.32,0.00,0.00%,0.00,United States,2020,8554,Finance,Business Services
DGICA,Donegal Group Inc. Class A Common Stock,$14.90,0.35,2.405%,451109122.00,United States,,43573,Finance,Property-Casualty Insurers
DGICB,Donegal Group Inc. Class B Common Stock,$13.55,0.00,0.00%,410236819.00,United States,1986,1,Finance,Property-Casualty Insurers
DGII,Digi International Inc. Common Stock,$19.18,0.23,1.214%,636954489.00,United States,1989,116552,Technology,Computer Communications Equipment
DGLY,Digital Ally Inc. Common Stock,$1.6779,-0.0721,-4.12%,67906611.00,United States,,2434288,Technology,Radio And Television Broadcasting And Communications Equipment
DGNS,Dragoneer Growth Opportunities Corp. II Class A Ordinary Shares,$10.26,0.16,1.584%,324010800.00,United States,2020,70461,Finance,Business Services
DGNU,Dragoneer Growth Opportunities Corp. III Class A Ordinary Shares,$10.12,0.11,1.099%,506000000.00,United States,2021,288553,Finance,Business Services
DHBCU,DHB Capital Corp. Unit,$9.91,0.08,0.814%,0.00,United States,2021,28885,Finance,Business Services
DHC,Diversified Healthcare Trust Common Shares of Beneficial Interest,$4.895,0.125,2.621%,1166324200.00,United States,,326586,Consumer Services,Real Estate Investment Trusts
DHCAU,DHC Acquisition Corp. Unit,$9.96,0.11,1.117%,0.00,United States,2021,26373,Finance,Business Services
DHCNI,Diversified Healthcare Trust 5.625% Senior Notes due 2042,$23.15,0.0508,0.22%,0.00,United States,,9937,Consumer Services,Real Estate Investment Trusts
DHCNL,Diversified Healthcare Trust 6.25% Senior Notes Due 2046,$24.10,0.29,1.218%,0.00,United States,,53842,Consumer Services,Real Estate Investment Trusts
DHHCU,DiamondHead Holdings Corp. Unit,$9.94,0.11,1.119%,0.00,United States,2021,58391,Finance,Business Services
DHHCW,DiamondHead Holdings Corp. Warrant,$0.68,0.09,15.254%,0.00,United States,2021,117905,Finance,Business Services
DHIL,Diamond Hill Investment Group Inc. Class A Common Stock,$162.99,3.99,2.509%,515051497.00,United States,,8622,Finance,Investment Managers
DIOD,Diodes Incorporated Common Stock,$79.48,1.47,1.884%,3519639227.00,United States,,221734,Technology,Semiconductors
DISAU,Disruptive Acquisition Corporation I Unit,$9.875,0.045,0.458%,0.00,United States,2021,11004,,
DISCA,Discovery Inc. Series A Common Stock,$41.77,-15.98,-27.671%,20355949325.00,United States,,83799567,Consumer Services,Television Services
DISCB,Discovery Inc. Series B Common Stock,$48.44,-12.77,-20.863%,23606468406.00,United States,,6813,Consumer Services,Television Services
DISCK,Discovery Inc. Series C Common Stock,$35.77,-15.27,-29.918%,17431944155.00,United States,,34037208,Consumer Services,Television Services
DISH,DISH Network Corporation Class A Common Stock,$35.70,-0.55,-1.517%,18785088494.00,United States,1995,2388983,Consumer Services,Television Services
DJCO,Daily Journal Corp. (S.C.) Common Stock,$315.00,-4.77,-1.492%,434934990.00,United States,,1798,Consumer Services,Newspapers/Magazines
DKNG,DraftKings Inc. Class A Common Stock,$62.74,-3.12,-4.737%,24952011010.00,United States,2019,14005788,Consumer Services,Services-Misc. Amusement & Recreation
DLCA,Deep Lake Capital Acquisition Corp. Class A Ordinary Shares,$9.77,0.08,0.826%,252798750.00,United States,2021,267000,Finance,Business Services
DLCAU,Deep Lake Capital Acquisition Corp. Unit,$10.03,0.07,0.703%,0.00,United States,2021,308107,Finance,Business Services
DLCAW,Deep Lake Capital Acquisition Corp. Warrant,$0.65,0.0698,12.03%,0.00,United States,2021,60351,Finance,Business Services
DLHC,DLH Holdings Corp.,$10.12,0.07,0.697%,126944329.00,United States,,5507,Technology,Professional Services
DLPN,Dolphin Entertainment Inc. Common Stock,$13.05,-4.77,-26.768%,85612463.00,United States,,4763020,Consumer Services,Other Consumer Services
DLTH,Duluth Holdings Inc. Class B Common Stock,$15.65,-0.33,-2.065%,513761267.00,United States,2015,174613,Consumer Services,Clothing/Shoe/Accessory Stores
DLTR,Dollar Tree Inc. Common Stock,$113.45,2.37,2.134%,26481603941.00,United States,1995,1127361,Consumer Services,Department/Specialty Retail Stores
DMAC,DiaMedica Therapeutics Inc. Common Stock,$9.75,-0.04,-0.409%,182705972.00,United States,2018,30795,Health Care,Major Pharmaceuticals
DMLP,Dorchester Minerals L.P. Common Units Representing Limited Partnership Interests,$13.98,0.08,0.576%,484823241.00,United States,,11316,Energy,Oil & Gas Production
DMRC,Digimarc Corporation Common Stock,$31.74,-1.40,-4.225%,534710735.00,United States,,111247,Technology,EDP Services
DMTK,DermTech Inc. Common Stock,$46.21,-3.96,-7.893%,1328799418.00,United States,2017,1197621,Health Care,Medical Specialities
DNLI,Denali Therapeutics Inc. Common Stock,$54.595,-1.005,-1.808%,6605126121.00,United States,2017,169649,Health Care,Biotechnology: Biological Products (No Diagnostic Substances)
DOCU,DocuSign Inc. Common Stock,$198.69,-1.60,-0.799%,38000837037.00,United States,2018,1624737,Technology,Computer Software: Prepackaged Software
DOGZ,Dogness (International) Corporation Class A Common Stock,$1.82,0.07,4.00%,53451145.00,China,2017,138913,Consumer Durables,Miscellaneous manufacturing industries
DOMO,Domo Inc. Class B Common Stock,$60.605,1.485,2.512%,1815075327.00,United States,2018,418227,Technology,Computer Software: Prepackaged Software
DOOO,BRP Inc. (Recreational Products) Common Subordinate Voting Shares,$82.335,1.245,1.535%,7238903904.00,Canada,,116844,Capital Goods,Industrial Specialties
DORM,Dorman Products Inc. Common Stock,$104.99,2.06,2.001%,3378268584.00,United States,,60136,Capital Goods,Auto Parts:O.E.M.
DOX,Amdocs Limited Ordinary Shares,$81.94,1.73,2.157%,10719800500.00,Guernsey,,409165,Technology,EDP Services
DOYU,DouYu International Holdings Limited ADS,$10.357,-0.903,-8.02%,3324043418.00,China,2019,3202574,Technology,Computer Software: Programming Data Processing
DRIO,DarioHealth Corp. Common Stock,$20.03,-0.71,-3.423%,305925982.00,Israel,,136205,Health Care,Medical/Dental Instruments
DRNA,Dicerna Pharmaceuticals Inc. Common Stock,$23.60,-0.37,-1.544%,1801173075.00,United States,2014,301411,Health Care,Major Pharmaceuticals
DRRX,DURECT Corporation Common Stock,$1.9166,-0.1034,-5.119%,435455091.00,United States,2000,898237,Health Care,Major Pharmaceuticals
DRTT,DIRTT Environmental Solutions Ltd. Common Shares,$2.90,-0.22,-7.051%,245575956.00,Canada,,136046,Technology,Computer Software: Prepackaged Software
DRVN,Driven Brands Holdings Inc. Common Stock,$23.11,0.32,1.404%,3868850947.00,United States,2021,261082,Consumer Services,Automotive Aftermarket
DSAC,Duddell Street Acquisition Corp. Class A Ordinary Shares,$10.00,0.19,1.937%,218750000.00,Hong Kong,2020,67736,Finance,Business Services
DSACU,Duddell Street Acquisition Corp. Unit,$10.4615,-0.5385,-4.895%,0.00,Hong Kong,2020,200,Finance,Business Services
DSACW,Duddell Street Acquisition Corp. Warrant,$1.20,-0.3199,-21.047%,0.00,Hong Kong,2020,21131,Finance,Business Services
DSEY,Diversey Holdings Ltd. Ordinary Shares,$14.50,-0.48,-3.204%,0.00,United States,2021,3452712,,
DSGN,Design Therapeutics Inc. Common Stock,$49.15,29.15,145.75%,0.00,United States,,1798704,,
DSGX,Descartes Systems Group Inc. (The) Common Stock,$59.07,0.08,0.136%,4991258937.00,Canada,,72619,Technology,Computer Software: Prepackaged Software
DSKE,Daseke Inc. Common Stock,$8.425,0.725,9.416%,547867893.00,United States,2015,1820985,Consumer Services,Transportation Services
DSKEW,Daseke Inc. Warrant,$0.28,0.04,16.667%,0.00,United States,2015,719098,Consumer Services,Transportation Services
DSP,Viant Technology Inc. Class A Common Stock,$44.40,-1.71,-3.709%,2616738820.00,United States,2021,267251,Technology,Computer Software: Programming Data Processing
DSPG,DSP Group Inc. Common Stock,$14.14,0.14,1.00%,342555767.00,United States,1994,112150,Technology,Semiconductors
DSWL,Deswell Industries Inc. Common Shares,$3.55,-0.02,-0.56%,56499098.00,Macau,1995,5227,Consumer Non-Durables,Plastic Products
DTEA,DAVIDsTEA Inc. Common Stock,$3.41,0.00,0.00%,89447393.00,Canada,2015,86304,Consumer Non-Durables,Food Chains
DTIL,Precision BioSciences Inc. Common Stock,$9.88,-0.32,-3.137%,563023537.00,United States,2019,368186,Health Care,Biotechnology: Biological Products (No Diagnostic Substances)
DTOCU,Digital Transformation Opportunities Corp. Units,$9.95,0.11,1.118%,0.00,United States,2021,9719,Finance,Business Services
DTSS,Datasea Inc. Common Stock,$3.5725,-0.1175,-3.184%,76703168.00,China,,66319,Technology,Computer Software: Prepackaged Software
DUNE,Dune Acquisition Corporation Class A Common Stock,$9.695,-0.005,-0.052%,,United States,2021,96210,Finance,Business Services
DUNEU,Dune Acquisition Corporation Unit,$9.97,0.03,0.302%,0.00,United States,2020,9472,Finance,Business Services
DUNEW,Dune Acquisition Corporation Warrant,$0.65,0.02,3.175%,0.00,United States,2021,18127,Finance,Business Services
DUO,Fangdd Network Group Ltd. American Depositary Shares,$6.41,-0.51,-7.37%,511817757.00,China,2019,76399,Finance,Real Estate
DUOT,Duos Technologies Group Inc. Common Stock,$10.264,1.634,18.934%,36273130.00,United States,,102117,Technology,Computer Software: Prepackaged Software
DVAX,Dynavax Technologies Corporation Common Stock,$10.0171,-0.2629,-2.557%,1134497689.00,United States,2004,1451885,Health Care,Major Pharmaceuticals
DWSN,Dawson Geophysical Company Common Stock,$2.58,0.08,3.20%,60573426.00,United States,,22211,Energy,Oil & Gas Production
DXCM,DexCom Inc. Common Stock,$346.83,-1.36,-0.391%,33357194809.00,United States,2005,474965,Health Care,Medical/Dental Instruments
DXPE,DXP Enterprises Inc. Common Stock,$30.565,0.325,1.075%,589699103.00,United States,,35923,Capital Goods,Industrial Machinery/Components
DXYN,Dixie Group Inc. (The) Common Stock,$3.48,0.03,0.87%,53723363.00,United States,,33148,Consumer Durables,Home Furnishings
DYAI,Dyadic International Inc. Common Stock,$5.225,0.085,1.654%,143594270.00,United States,,132000,Health Care,Biotechnology: Biological Products (No Diagnostic Substances)
DYN,Dyne Therapeutics Inc. Common Stock,$14.47,-0.21,-1.431%,744436686.00,United States,2020,110380,Health Care,Major Pharmaceuticals
DYNT,Dynatronics Corporation Common Stock,$1.1317,-0.0283,-2.44%,16946651.00,United States,,100127,Health Care,Medical/Dental Instruments
DZSI,DZS Inc. Common Stock,$15.2001,0.0001,0.001%,407974104.00,United States,,79322,Public Utilities,Telecommunications Equipment
EA,Electronic Arts Inc. Common Stock,$132.12,2.09,1.607%,38001150687.00,United States,,1307927,Technology,Computer Software: Prepackaged Software
EAC,Edify Acquisition Corp. Class A Common Stock,$9.65,0.00,0.00%,332925000.00,United States,2021,5620,Finance,Business Services
EACPU,Edify Acquisition Corp. Units,$9.8407,-0.0293,-0.297%,0.00,United States,2021,3639,Finance,Business Services
EACPW,Edify Acquisition Corp. Warrant,$0.4701,-0.0299,-5.98%,0.00,United States,2021,8600,Finance,Business Services
EAR,Eargo Inc. Common Stock,$45.82,-6.55,-12.507%,1754696236.00,United States,2020,436523,Health Care,Industrial Specialties
EARS,Auris Medical Holding Ltd. Common Shares 0.01 SF (Bermuda),$3.36,-0.05,-1.466%,23820760.00,Bermuda,2014,413588,Health Care,Major Pharmaceuticals
EAST,Eastside Distilling Inc. Common Stock,$1.7818,-0.0182,-1.011%,20222097.00,United States,,51378,Consumer Non-Durables,Beverages (Production/Distribution)
EBACU,European Biotech Acquisition Corp. Units,$10.00,0.00,0.00%,0.00,Netherlands,2021,225513,Finance,Business Services
EBAY,eBay Inc. Common Stock,$60.165,2.075,3.572%,40939019572.00,United States,1998,4591067,Miscellaneous,Business Services
EBC,Eastern Bankshares Inc. Common Stock,$19.21,0.24,1.265%,3587624138.00,United States,2020,368954,Finance,Savings Institutions
EBIX,Ebix Inc. Common Stock,$30.40,-0.81,-2.595%,941261794.00,United States,,292589,Technology,EDP Services
EBMT,Eagle Bancorp Montana Inc. Common Stock,$24.82,0.18,0.731%,168166595.00,United States,,14055,Finance,Major Banks
EBON,Ebang International Holdings Inc. Class A Ordinary Shares,$7.688,-0.052,-0.672%,1321070071.00,China,2020,8745514,Technology,Semiconductors
EBSB,Meridian Bancorp Inc. Common Stock,$18.86,0.35,1.891%,988597162.00,United States,,47441,Finance,Major Banks
EBTC,Enterprise Bancorp Inc Common Stock,$32.55,0.12,0.37%,389230524.00,United States,,5784,Finance,Major Banks
ECHO,Echo Global Logistics Inc. Common Stock,$31.17,1.03,3.417%,829375132.00,United States,2009,61480,Transportation,Oil Refining/Marketing
ECOL,US Ecology Inc Common Stock,$42.03,0.74,1.792%,1323925498.00,United States,,60366,Public Utilities,Environmental Services
ECOLW,US Ecology Inc. Warrant,$10.45,0.00,0.00%,0.00,United States,,20,Public Utilities,Environmental Services
ECOR,electroCore Inc. Common Stock,$2.02,-0.07,-3.349%,97923106.00,United States,2018,352839,Health Care,Biotechnology: Electromedical & Electrotherapeutic Apparatus
ECPG,Encore Capital Group Inc Common Stock,$41.08,0.83,2.062%,1287675975.00,United States,,290473,Finance,Finance Companies
EDAP,EDAP TMS S.A. American Depositary Shares,$7.98,0.19,2.439%,232549697.00,France,1997,57953,Health Care,Biotechnology: Electromedical & Electrotherapeutic Apparatus
EDIT,Editas Medicine Inc. Common Stock,$39.07,-3.11,-7.373%,2631864244.00,United States,2016,1301232,Health Care,Biotechnology: Biological Products (No Diagnostic Substances)
EDRY,EuroDry Ltd. Common Shares ,$8.59,-0.15,-1.716%,19796772.00,Greece,,12520,Consumer Services,Marine Transportation
EDSA,Edesa Biotech Inc. Common Shares,$5.3385,0.1885,3.66%,70353113.00,United States,,281189,Health Care,Major Pharmaceuticals
EDTK,Skillful Craftsman Education Technology Limited Ordinary Share,$3.60,0.28,8.434%,43200000.00,China,2020,3595410,Consumer Services,Other Consumer Services
EDTX,EdtechX Holdings Acquisition Corp. II Class A common stock,$9.93,0.15,1.534%,78509063.00,United Kingdom,2021,60474,Finance,Business Services
EDTXU,EdtechX Holdings Acquisition Corp. II Unit,$10.05,0.13,1.31%,144468750.00,United Kingdom,2020,20532,Finance,Business Services
EDTXW,EdtechX Holdings Acquisition Corp. II Warrant,$0.5236,-0.0164,-3.037%,0.00,United Kingdom,2021,20666,Finance,Business Services
EDUC,Educational Development Corporation Common Stock,$17.405,0.635,3.787%,145348668.00,United States,,13493,Consumer Durables,Consumer Specialties
EEFT,Euronet Worldwide Inc. Common Stock,$139.275,-0.265,-0.19%,7347153323.00,United States,1997,281297,Finance,Investment Bankers/Brokers/Service
