Symbol,Name,Last Sale,Net Change,% Change,Market Cap,Country,IPO Year,Volume,Sector,Industry
IPAR,Inter Parfums Inc. Common Stock,$70.465,-0.005,-0.007%,2229167181.00,United States,,63683,Consumer Non-Durables,Package Goods/Cosmetics
IPDN,Professional Diversity Network Inc. Common Stock,$2.4384,-0.1016,-4.00%,31259905.00,United States,2013,1109974,Technology,Computer Software: Programming Data Processing
IPGP,IPG Photonics Corporation Common Stock,$204.99,1.58,0.777%,10973851024.00,United States,2006,130480,Technology,Semiconductors
IPHA,Innate Pharma S.A. ADS,$4.38,-0.08,-1.794%,345893703.00,France,2019,889,Health Care,Biotechnology: Biological Products (No Diagnostic Substances)
IPHI,Inphi Corporation Common Stock,$171.42,3.42,2.036%,9200577320.00,United States,2010,967986,Technology,Semiconductors
IPLDP,Interstate Power & Light Company Perp Prd Ser D,$26.19,-0.035,-0.133%,0.00,United States,,21495,Public Utilities,Power Generation
IPVIU,InterPrivate IV InfraTech Partners Inc. Units,$9.8701,0.0202,0.205%,0.00,United States,2021,1258,Finance,Business Services
IPWR,Ideal Power Inc. Common Stock,$11.9901,0.2801,2.392%,67934648.00,United States,2013,123361,Energy,Industrial Machinery/Components
IQ,iQIYI Inc. American Depositary Shares,$15.28,-4.80,-23.904%,12060273394.00,China,2018,100431219,Consumer Services,Consumer Electronics/Video Chains
IRBT,iRobot Corporation Common Stock,$110.595,-2.375,-2.102%,3118684220.00,United States,2005,236941,Consumer Durables,Consumer Electronics/Appliances
IRCP,IRSA Propiedades Comerciales S.A. American Depositary Shares,$9.67,-0.39,-3.877%,304638961.00,Argentina,,11906,Consumer Services,Building operators
IRDM,Iridium Communications Inc Common Stock,$37.32,-1.03,-2.686%,5011315904.00,United States,,595337,Capital Goods,Telecommunications Equipment
IRIX,IRIDEX Corporation Common Stock,$7.06,-0.21,-2.889%,98116795.00,United States,1996,49601,Health Care,Biotechnology: Electromedical & Electrotherapeutic Apparatus
IRMD,iRadimed Corporation Common Stock,$23.73,-0.12,-0.503%,292137562.00,United States,2014,8122,Health Care,Medical/Dental Instruments
IROQ,IF Bancorp Inc. Common Stock,$21.037,0.15,0.718%,68167790.00,United States,2011,241,Finance,Savings Institutions
IRTC,iRhythm Technologies Inc. Common Stock,$132.805,-4.225,-3.083%,3872681451.00,United States,2016,216522,Health Care,Medical/Dental Instruments
IRWD,Ironwood Pharmaceuticals Inc. Class A Common Stock,$10.77,-0.14,-1.283%,1733562625.00,United States,2010,624736,Health Care,Major Pharmaceuticals
ISBC,Investors Bancorp Inc. Common Stock,$14.615,0.305,2.131%,3615546902.00,United States,,1279736,Finance,Major Banks
ISEE,IVERIC bio Inc. Common Stock,$6.10,-0.20,-3.175%,546362018.00,United States,2013,214670,Health Care,Major Pharmaceuticals
ISIG,Insignia Systems Inc. Common Stock,$5.93,-0.12,-1.983%,10401398.00,United States,1991,27938,Consumer Services,Advertising
ISLEU,Isleworth Healthcare Acquisition Corporation Unit,$9.92,0.11,1.121%,0.00,United States,2021,38847,Finance,Business Services
ISNS,Image Sensing Systems Inc. Common Stock,$4.595,0.095,2.111%,24595316.00,United States,1995,1783,Capital Goods,Industrial Machinery/Components
ISRG,Intuitive Surgical Inc. Common Stock,$722.15,17.65,2.505%,85486766580.00,United States,2000,317503,Health Care,Industrial Specialties
ISSC,Innovative Solutions and Support Inc. Common Stock,$6.05,-0.04,-0.657%,104313326.00,United States,2000,37366,Technology,EDP Services
ISTR,Investar Holding Corporation Common Stock,$20.7795,-0.2705,-1.285%,216012752.00,United States,2014,20523,Finance,Major Banks
ISUN,iSun Inc. Common Stock,$13.36,0.21,1.597%,113273882.00,United States,2016,361363,Technology,Semiconductors
ITAC,Industrial Tech Acquisitions Inc. Class A common stock,$10.04,0.13,1.312%,97164469.00,United States,2020,118138,Finance,Business Services
ITACU,Industrial Tech Acquisitions Inc. Unit,$11.20,0.20,1.818%,0.00,United States,2020,1563,Finance,Business Services
ITACW,Industrial Tech Acquisitions Inc. Warrant,$1.17,0.04,3.54%,0.00,United States,2020,217162,Finance,Business Services
ITCI,Intra-Cellular Therapies Inc. Common Stock,$31.79,-0.01,-0.031%,2572351843.00,United States,,299063,Health Care,Major Pharmaceuticals
ITHX,ITHAX Acquisition Corp. Class A Ordinary Shares,$9.91,0.00,0.00%,0.00,United States,2021,20,Finance,Business Services
ITHXU,ITHAX Acquisition Corp. Unit,$9.92,0.03,0.303%,0.00,United States,2021,15216,Finance,Business Services
ITHXW,ITHAX Acquisition Corp. Warrant,$0.70,0.00,0.00%,0.00,United States,2021,50,Finance,Business Services
ITI,Iteris Inc. Common Stock,$6.22,0.22,3.667%,259004482.00,United States,,166010,Capital Goods,Telecommunications Equipment
ITIC,Investors Title Company Common Stock,$166.00,0.17,0.103%,314424252.00,United States,,1327,Finance,Specialty Insurers
ITMR,Itamar Medical Ltd. American Depository Shares,$23.09,1.22,5.578%,378237336.00,Israel,,20287,Health Care,Medical/Dental Instruments
ITOS,iTeos Therapeutics Inc. Common Stock,$34.05,1.96,6.108%,1193274010.00,United States,2020,97482,Health Care,Biotechnology: Biological Products (No Diagnostic Substances)
ITQRU,Itiquira Acquisition Corp. Unit,$9.915,0.015,0.152%,0.00,United States,2021,185722,Finance,Business Services
ITRI,Itron Inc. Common Stock,$87.86,0.74,0.849%,3964391156.00,United States,1993,617575,Capital Goods,Electrical Products
ITRM,Iterum Therapeutics plc Ordinary Share,$1.3823,-0.0377,-2.655%,243945488.00,Ireland,2018,9109096,Health Care,Major Pharmaceuticals
ITRN,Ituran Location and Control Ltd. Ordinary Shares,$21.03,-0.21,-0.989%,493688314.00,Israel,2005,36528,Technology,Electronic Components
IVA,Inventiva S.A. American Depository Shares,$14.26,0.23,1.639%,550867522.00,France,2020,33086,Health Care,Major Pharmaceuticals
IVAC,Intevac Inc. Common Stock,$5.70,0.12,2.151%,137310840.00,United States,1995,39242,Technology,Industrial Machinery/Components
IZEA,IZEA Worldwide Inc. Common Stock,$4.03,-0.22,-5.176%,219687056.00,United States,,3376495,Consumer Services,Advertising
JACK,Jack In The Box Inc. Common Stock,$110.87,0.24,0.217%,2530925947.00,United States,,214046,Consumer Services,Restaurants
JAGX,Jaguar Health Inc. Common Stock,$1.785,-0.085,-4.545%,210301564.00,United States,2015,3046350,Health Care,Major Pharmaceuticals
JAKK,JAKKS Pacific Inc. Common Stock,$7.43,-0.10,-1.328%,45156182.00,United States,1996,101726,Consumer Non-Durables,Recreational Products/Toys
JAMF,Jamf Holding Corp. Common Stock,$34.48,-0.46,-1.317%,4050173995.00,United States,2020,118522,Technology,Computer Software: Prepackaged Software
JAN,JanOne Inc. Common Stock (NV),$7.65,-0.09,-1.163%,18370787.00,United States,,121782,Consumer Services,Home Furnishings
JAZZ,Jazz Pharmaceuticals plc Common Stock (Ireland),$167.025,0.365,0.219%,9407755948.00,Ireland,2007,249468,Health Care,Major Pharmaceuticals
JBHT,J.B. Hunt Transport Services Inc. Common Stock,$165.98,4.56,2.825%,17544916896.00,United States,,295157,Transportation,Trucking Freight/Courier Services
JBLU,JetBlue Airways Corporation Common Stock,$19.575,-0.065,-0.331%,6186265874.00,United States,2002,4613117,Transportation,Air Freight/Delivery Services
JBSS,John B. Sanfilippo & Son Inc. Common Stock,$90.39,1.29,1.448%,1036412915.00,United States,1991,17867,Consumer Non-Durables,Specialty Foods
JCIC,Jack Creek Investment Corp. Class A Ordinary Shares,$9.65,-0.04,-0.413%,416156250.00,United States,2021,2494,Finance,Business Services
JCICU,Jack Creek Investment Corp. Units,$9.9413,0.0513,0.519%,0.00,United States,2021,30283,Finance,Business Services
JCICW,Jack Creek Investment Corp. Warrants,$0.5898,-0.0602,-9.262%,0.00,United States,2021,17577,Finance,Business Services
JCOM,j2 Global Inc. Common Stock,$118.14,0.31,0.263%,5336448068.00,United States,1999,225795,Technology,Telecommunications Equipment
JCS,Communications Systems Inc. Common Stock,$5.99,-0.20,-3.231%,55872168.00,United States,,24924,Public Utilities,Telecommunications Equipment
JCTCF,Jewett-Cameron Trading Company Common Shares,$10.12,0.12,1.20%,35310309.00,United States,,2325,Consumer Services,RETAIL: Building Materials
JD,JD.com Inc. American Depositary Shares,$81.09,2.38,3.024%,125831366955.00,China,2014,15288365,Consumer Services,Other Specialty Stores
JFIN,Jiayin Group Inc. American Depositary Shares,$8.645,-0.735,-7.836%,467046125.00,China,2019,830045,Finance,Finance: Consumer Services
JFU,9F Inc. American Depositary Shares,$1.695,-0.045,-2.586%,330848745.00,China,2019,1252150,Finance,Finance: Consumer Services
JG,Aurora Mobile Limited American Depositary Shares,$4.13,-0.25,-5.708%,477936102.00,China,2018,969891,Technology,Computer Software: Programming Data Processing
JJSF,J & J Snack Foods Corp. Common Stock,$156.96,-0.81,-0.513%,2979043824.00,United States,1986,37005,Consumer Non-Durables,Specialty Foods
JKHY,Jack Henry & Associates Inc. Common Stock,$153.425,0.645,0.422%,11672154996.00,United States,1985,427286,Technology,EDP Services
JMPNL,JMP Group LLC 7.25% Senior Notes due 2027,$25.51,0.1337,0.527%,0.00,United States,,2133,Finance,Investment Bankers/Brokers/Service
JMPNZ,JMP Group LLC 6.875% Senior Notes due 2029,$24.75,0.2355,0.961%,0.00,United States,,6383,Finance,Investment Bankers/Brokers/Service
JNCE,Jounce Therapeutics Inc. Common Stock,$9.85,-0.17,-1.697%,503764076.00,United States,2017,506388,Health Care,Biotechnology: Biological Products (No Diagnostic Substances)
JOAN,JOANN Inc. Common Stock,$10.25,-0.03,-0.292%,413804083.00,United States,2021,212998,Consumer Services,Other Specialty Stores
JOBS,51job Inc. American Depositary Shares,$61.12,-1.33,-2.13%,4119894876.00,China,2004,154831,Technology,Diversified Commercial Services
JOFFU,JOFF Fintech Acquisition Corp. Unit,$9.95,0.11,1.118%,0.00,United States,2021,527020,Finance,Business Services
JOUT,Johnson Outdoors Inc. Class A Common Stock,$136.60,1.64,1.215%,1381322695.00,United States,,16189,Consumer Non-Durables,Recreational Products/Toys
JRJC,China Finance Online Co. Limited American Depositary Shares,$11.53,-0.4202,-3.516%,28155799.00,China,2004,41249,Finance,Investment Bankers/Brokers/Service
JRSH,Jerash Holdings (US) Inc. Common Stock,$5.99,-0.01,-0.167%,67836750.00,United States,2018,49069,Consumer Non-Durables,Apparel
JRVR,James River Group Holdings Ltd. Common Shares,$45.44,0.41,0.911%,1397984774.00,Bermuda,2014,117675,Finance,Property-Casualty Insurers
JSM,Navient Corporation 6% Senior Notes due December 15 2043,$23.96,-0.11,-0.457%,0.00,United States,,10715,Finance,Finance: Consumer Services
JUPW,Jupiter Wellness Inc. Common Stock,$4.645,-0.355,-7.10%,42651937.00,United States,2020,167741,Consumer Non-Durables,Package Goods/Cosmetics
JUPWW,Jupiter Wellness Inc. Warrant,$2.2006,0.0856,4.047%,0.00,United States,2020,14658,Consumer Non-Durables,Package Goods/Cosmetics
JVA,Coffee Holding Co. Inc. Common Stock,$4.94,-0.10,-1.984%,28200479.00,United States,2005,11696,Consumer Non-Durables,Packaged Foods
JWEL,Jowell Global Ltd. Ordinary Shares,$6.8313,-0.1187,-1.708%,169851469.00,China,2021,37369,Consumer Services,Other Consumer Services
JYAC,Jiya Acquisition Corp. Class A Common Stock,$9.77,0.11,1.139%,134113181.00,United States,2020,12207,Finance,Business Services
JYNT,The Joint Corp. Common Stock,$45.34,0.89,2.002%,641102658.00,United States,2014,73486,Miscellaneous,Multi-Sector Companies
KAIIU,Kismet Acquisition Two Corp. Unit,$9.95,0.20,2.051%,0.00,United States,2021,29735,Finance,Business Services
KAIR,Kairos Acquisition Corp. Class A Ordinary Shares,$9.68,-0.02,-0.206%,0.00,United States,2021,4212,Finance,Business Services
KAIRU,Kairos Acquisition Corp. Unit,$9.98,-0.02,-0.20%,0.00,United States,2021,23092,Finance,Business Services
KAIRW,Kairos Acquisition Corp. Warrant,$0.705,0.005,0.714%,0.00,United States,2021,102507,Finance,Business Services
KALA,Kala Pharmaceuticals Inc. Common Stock,$6.745,-0.455,-6.319%,378123789.00,United States,2017,5369411,Health Care,Major Pharmaceuticals
KALU,Kaiser Aluminum Corporation Common Stock,$111.04,3.99,3.727%,1755783246.00,United States,,69335,Capital Goods,Metal Fabrications
KALV,KalVista Pharmaceuticals Inc. Common Stock,$27.05,-1.87,-6.466%,657536567.00,United Kingdom,2015,220143,Health Care,Major Pharmaceuticals
KBAL,Kimball International Inc. Class B Common Stock,$13.66,0.13,0.961%,503806918.00,United States,,101372,Consumer Durables,Home Furnishings
KBNT,Kubient Inc. Common Stock,$6.85,-0.11,-1.58%,80666621.00,United States,2020,1036365,Technology,EDP Services
KBNTW,Kubient Inc. Warrant,$2.80,-0.055,-1.926%,0.00,United States,2020,31733,Technology,EDP Services
KBSF,KBS Fashion Group Limited Common Stock,$4.33,-0.41,-8.65%,11220325.00,China,2013,261991,Consumer Non-Durables,Apparel
KC,Kingsoft Cloud Holdings Limited American Depositary Shares,$39.71,-1.03,-2.528%,8841083720.00,China,2020,1563261,Technology,Computer Software: Prepackaged Software
KCAPL,KCAP Financial Inc. 6.125% Notes due 2022,$25.25,-0.0292,-0.116%,0.00,United States,,2564,,
KDMN,Kadmon Holdings Inc. Common Stock,$3.84,-0.30,-7.246%,659777069.00,United States,,3643260,Health Care,Major Pharmaceuticals
KDNY,Chinook Therapeutics Inc. Common Stock,$16.38,-0.92,-5.318%,690555116.00,United States,2015,55634,Health Care,Major Pharmaceuticals
KDP,Keurig Dr Pepper Inc. Common Stock,$35.135,0.595,1.723%,49444335602.00,United States,,5001558,Consumer Non-Durables,Beverages (Production/Distribution)
KE,Kimball Electronics Inc. Common Stock,$25.79,0.48,1.896%,643642603.00,United States,,60879,Technology,Electrical Products
KELYA,Kelly Services Inc. Class A Common Stock,$22.03,0.31,1.427%,865814270.00,United States,,117819,Technology,Professional Services
KELYB,Kelly Services Inc. Class B Common Stock,$20.1801,0.00,0.00%,793110238.00,United States,,183,Technology,Professional Services
KEQU,Kewaunee Scientific Corporation Common Stock,$12.15,0.08,0.663%,33567984.00,United States,,867,Capital Goods,Medical Specialities
KERN,Akerna Corp. Common Stock,$4.9778,-0.1372,-2.682%,69981432.00,United States,2018,884271,Technology,EDP Services
KERNW,Akerna Corp Warrant,$1.31,-0.14,-9.655%,0.00,United States,2018,9728,Technology,EDP Services
KFFB,Kentucky First Federal Bancorp Common Stock,$6.83,0.13,1.94%,56307988.00,United States,,1225,Finance,Savings Institutions
KFRC,Kforce Inc. Common Stock,$53.50,1.37,2.628%,1181656052.00,United States,1995,38646,Technology,Professional Services
KHC,The Kraft Heinz Company Common Stock,$39.71,0.51,1.301%,48572308913.00,United States,,4125895,Consumer Non-Durables,Packaged Foods
KIDS,OrthoPediatrics Corp. Common Stock,$46.2375,-1.7625,-3.672%,908952265.00,United States,2017,96808,Health Care,Medical/Dental Instruments
KIIIU,Kismet Acquisition Three Corp. Unit,$9.90,0.13,1.331%,0.00,United States,2021,32337,Finance,Business Services
KIN,Kindred Biosciences Inc. Common Stock,$4.56,0.02,0.441%,189008434.00,United States,2013,158110,Health Care,Major Pharmaceuticals
KINS,Kingstone Companies Inc. Common Stock,$7.63,-0.21,-2.679%,81451761.00,United States,,26276,Finance,Property-Casualty Insurers
KINZ,KINS Technology Group Inc. Class A Common Stock,$9.83,0.00,0.00%,339135000.00,United States,2021,126923,Finance,Business Services
KINZU,KINS Technology Group Inc. Unit,$10.12,-0.04,-0.394%,0.00,United States,2020,20160,Finance,Business Services
KINZW,KINS Technology Group Inc. Warrant,$0.68,-0.0501,-6.862%,0.00,United States,2021,109373,Finance,Business Services
KIRK,Kirkland's Inc. COMMONSTOCK,$25.66,0.37,1.463%,365798593.00,United States,2002,336084,Consumer Services,Other Specialty Stores
KLAC,KLA Corporation Common Stock,$316.9525,17.5425,5.859%,48834345821.00,United States,1980,991883,Capital Goods,Electronic Components
KLAQ,KL Acquisition Corp Class A Common Stock,$9.70,0.05,0.518%,348593750.00,United States,2021,6407,Finance,Business Services
KLAQU,KL Acquisition Corp Unit,$9.90,0.09,0.917%,0.00,United States,2021,43682,Finance,Business Services
KLAQW,KL Acquisition Corp Warrant,$0.64,-0.01,-1.538%,0.00,United States,2021,10400,Finance,Business Services
KLDO,Kaleido Biosciences Inc. Common Stock,$7.48,-0.87,-10.419%,317651597.00,United States,2019,285151,Health Care,Biotechnology: Biological Products (No Diagnostic Substances)
KLIC,Kulicke and Soffa Industries Inc. Common Stock,$46.03,1.69,3.811%,2857403712.00,Singapore,,485768,Technology,Semiconductors
KLXE,KLX Energy Services Holdings Inc. Common Stock,$17.00,0.21,1.251%,144672006.00,United States,,31163,Energy,Oilfield Services/Equipment
KMDA,Kamada Ltd. Ordinary Shares,$6.05,-0.16,-2.576%,270709452.00,Israel,2013,84829,Health Care,Major Pharmaceuticals
KMPH,KemPharm Inc. Common Stock,$9.3201,-0.2899,-3.017%,264470149.00,United States,,647297,Health Care,Major Pharmaceuticals
KNDI,Kandi Technologies Group Inc Common Stock,$5.7648,-0.2252,-3.76%,417242129.00,China,,2362996,Capital Goods,Auto Manufacturing
KNSA,Kiniksa Pharmaceuticals Ltd. Class A Common Stock,$16.36,-0.32,-1.918%,1116280493.00,United States,2018,357818,Health Care,Major Pharmaceuticals
KNSL,Kinsale Capital Group Inc. Common Stock,$166.24,2.47,1.508%,3785805796.00,United States,2016,70368,Finance,Property-Casualty Insurers
KNTE,Kinnate Biopharma Inc. Common Stock,$28.63,-0.57,-1.952%,1240458280.00,United States,2020,33876,Health Care,Major Pharmaceuticals
KOD,Kodiak Sciences Inc Common Stock,$115.26,-4.19,-3.508%,5896980990.00,United States,2018,205570,Health Care,Biotechnology: Biological Products (No Diagnostic Substances)
KOPN,Kopin Corporation Common Stock,$8.725,-0.315,-3.485%,793845600.00,United States,1992,2847730,Technology,Semiconductors
KOR,Corvus Gold Inc. Common Shares,$1.86,-0.03,-1.587%,235537092.00,Canada,,84274,Basic Industries,Precious Metals
KOSS,Koss Corporation Common Stock,$21.25,-4.55,-17.636%,180982489.00,United States,,4201354,Consumer Non-Durables,Consumer Electronics/Appliances
KPTI,Karyopharm Therapeutics Inc. Common Stock,$10.198,-0.452,-4.244%,761120500.00,United States,2013,2109529,Health Care,Major Pharmaceuticals
KRBP,Kiromic BioPharma Inc. Common Stock,$9.50,-0.3799,-3.845%,69663491.00,United States,2020,1240,Health Care,Biotechnology: Biological Products (No Diagnostic Substances)
KRKR,36Kr Holdings Inc. American Depositary Shares,$3.3364,-0.0136,-0.406%,125096116.00,China,2019,177627,Miscellaneous,Business Services
KRMD,Repro Med Systems Inc. Common Stock,$3.37,-0.14,-3.989%,148087533.00,United States,,235681,Health Care,Medical/Dental Instruments
KRNLU,Kernel Group Holdings Inc. Units,$9.90,0.00,0.00%,0.00,United States,2021,21028,Finance,Business Services
KRNLW,Kernel Group Holdings Inc. Warrants,$0.45,0.45,,,United States,,12515,,
KRNT,Kornit Digital Ltd. Ordinary Shares,$91.66,-3.70,-3.88%,4150174880.00,Israel,2015,96961,Capital Goods,Industrial Machinery/Components
KRNY,Kearny Financial Corp Common Stock,$12.56,0.13,1.046%,1057555278.00,United States,,139754,Finance,Savings Institutions
KRON,Kronos Bio Inc. Common Stock,$28.55,-0.03,-0.105%,1599756539.00,United States,2020,122178,Health Care,Major Pharmaceuticals
KROS,Keros Therapeutics Inc. Common Stock,$55.73,-3.49,-5.893%,1291729501.00,United States,2020,67258,Health Care,Major Pharmaceuticals
KRTX,Karuna Therapeutics Inc. Common Stock,$113.91,-0.62,-0.541%,3077703990.00,United States,2019,45905,Health Care,Major Pharmaceuticals
KRUS,Kura Sushi USA Inc. Class A Common Stock,$29.99,-2.00,-6.252%,251066863.00,United States,2019,59067,Consumer Services,Restaurants
KRYS,Krystal Biotech Inc. Common Stock,$67.79,-3.40,-4.776%,1504582238.00,United States,2017,71540,Health Care,Biotechnology: Biological Products (No Diagnostic Substances)
KSICU,Kadem Sustainable Impact Corporation Unit,$9.90,0.05,0.508%,0.00,United States,2021,162191,Finance,Business Services
KSMT,Kismet Acquisition One Corp Ordinary Shares,$9.945,0.035,0.353%,315753750.00,Russia,2020,204025,Finance,Business Services
KSMTU,Kismet Acquisition One Corp Unit,$10.29,0.00,0.00%,0.00,Russia,2020,2,Finance,Business Services
KSMTW,Kismet Acquisition One Corp Warrant,$0.78,0.0688,9.674%,0.00,Russia,,2923,Finance,Business Services
KSPN,Kaspien Holdings Inc. Common Stock,$21.93,-2.45,-10.049%,54359031.00,United States,,24612,Consumer Services,Consumer Electronics/Video Chains
KTCC,Key Tronic Corporation Common Stock,$8.02,-0.05,-0.62%,86292634.00,United States,1983,21148,Technology,Electrical Products
KTOS,Kratos Defense & Security Solutions Inc. Common Stock,$25.62,0.31,1.225%,3163124520.00,United States,,889201,Capital Goods,Military/Government/Technical
KTRA,Kintara Therapeutics Inc. Common Stock,$1.89,-0.03,-1.563%,57883174.00,United States,,176593,Health Care,Major Pharmaceuticals
KURA,Kura Oncology Inc. Common Stock,$26.51,-0.79,-2.894%,1755259310.00,United States,,387071,Health Care,Major Pharmaceuticals
KURIU,Alkuri Global Acquisition Corp. Unit,$9.90,0.12,1.227%,0.00,United States,2021,93378,Finance,Business Services
KVHI,KVH Industries Inc. Common Stock,$12.74,0.36,2.908%,234796162.00,United States,1996,53266,Technology,Radio And Television Broadcasting And Communications Equipment
KVSA,Khosla Ventures Acquisition Co. Class A Common Stock,$10.11,0.07,0.697%,459903900.00,United States,2021,421138,Finance,Business Services
KVSB,Khosla Ventures Acquisition Co. II Class A Common Stock,$10.03,0.03,0.30%,462383000.00,United States,2021,433173,Finance,Business Services
KVSC,Khosla Ventures Acquisition Co. III Class A Common Stock,$9.98,0.12,1.217%,561874000.00,United States,2021,1139826,Finance,Business Services
KXIN,Kaixin Auto Holdings Ordinary Share,$3.1399,-0.0201,-0.636%,204508435.00,China,2017,1354739,Consumer Durables,Automotive Aftermarket
KYMR,Kymera Therapeutics Inc. Common Stock,$38.42,-1.15,-2.906%,1721657254.00,United States,2020,125065,Health Care,Biotechnology: Biological Products (No Diagnostic Substances)
KZIA,Kazia Therapeutics Limited American Depositary Shares,$11.12,-0.15,-1.331%,140760029.00,Australia,,133781,Health Care,Major Pharmaceuticals
KZR,Kezar Life Sciences Inc. Common Stock,$6.08,-0.48,-7.317%,292243365.00,United States,2018,180782,Health Care,Major Pharmaceuticals
LABP,Landos Biopharma Inc. Common Stock,$10.56,-0.79,-6.96%,413563117.00,United States,2021,120023,Health Care,Major Pharmaceuticals
LACQ,Leisure Acquisition Corp. Common Stock,$13.38,1.0344,8.379%,83280706.00,United States,2017,1102,Finance,Business Services
LACQW,Leisure Acquisition Corp. Warrant,$0.86,0.0301,3.627%,0.00,United States,2017,5792,Finance,Business Services
LAKE,Lakeland Industries Inc. Common Stock,$27.18,0.35,1.305%,217983056.00,United States,1986,86058,Health Care,Industrial Specialties
LAMR,Lamar Advertising Company Class A Common Stock,$93.605,-0.125,-0.133%,9445842580.00,United States,1996,291188,Consumer Services,Real Estate Investment Trusts
LANC,Lancaster Colony Corporation Common Stock,$182.23,1.49,0.824%,5020254270.00,United States,,59993,Consumer Non-Durables,Packaged Foods
LAND,Gladstone Land Corporation Common Stock,$18.135,0.175,0.974%,484987334.00,United States,1993,96007,Consumer Services,Real Estate Investment Trusts
LANDM,Gladstone Land Corporation 5.00% Series D Cumulative Term Preferred Stock,$25.70,0.13,0.508%,619431834.00,United States,,2286,Consumer Services,Real Estate Investment Trusts
LANDO,Gladstone Land Corporation 6.00% Series B Cumulative Redeemable Preferred Stock,$25.5397,0.0422,0.166%,0.00,United States,,18148,Consumer Services,Real Estate Investment Trusts
LARK,Landmark Bancorp Inc. Common Stock,$27.545,-0.195,-0.703%,130958874.00,United States,,7322,Finance,Major Banks
LASR,nLIGHT Inc. Common Stock,$32.14,0.72,2.292%,1360812614.00,United States,2018,133558,Technology,Semiconductors
LATN,Union Acquisition Corp. II Ordinary Shares,$10.02,0.01,0.10%,250500000.00,United States,2019,41222,Finance,Business Services
LATNU,Union Acquisition Corp. II Units containing one ordinary share and one redeemable warrant,$10.45,-0.09,-0.854%,0.00,United States,2019,1218,Finance,Business Services
LATNW,Union Acquisition Corp. II Warrant,$0.52,-0.03,-5.455%,0.00,United States,2019,159799,Finance,Business Services
LAUR,Laureate Education Inc. Class A Common Stock,$13.845,0.255,1.876%,2754605077.00,United States,2017,287610,Consumer Services,Other Consumer Services
LAWS,Lawson Products Inc. Common Stock,$50.55,-1.41,-2.714%,458035521.00,United States,,4618,Consumer Durables,Industrial Specialties
LAZR,Luminar Technologies Inc.  Class A Common Stock,$24.35,-1.66,-6.382%,7887847444.00,United States,2019,2873765,Capital Goods,Auto Parts:O.E.M.
LAZY,Lazydays Holdings Inc. Common Stock,$17.23,-0.98,-5.382%,185349881.00,United States,,151157,Consumer Durables,Automotive Aftermarket
LBAI,Lakeland Bancorp Inc. Common Stock,$17.60,0.31,1.793%,888817934.00,United States,,59959,Finance,Major Banks
LBC,Luther Burbank Corporation Common Stock,$11.71,0.11,0.948%,611603206.00,United States,2017,32132,Finance,Major Banks
LBPH,Longboard Pharmaceuticals Inc. Common Stock,$16.3718,-0.0482,-0.294%,276961577.00,United States,2021,6466,Health Care,Major Pharmaceuticals
LBPS,4D pharma plc American Depositary Shares,$11.6564,-0.3436,-2.863%,260789197.00,United Kingdom,,11837,Health Care,Major Pharmaceuticals
LBPSW,4D pharma plc Warrant,$1.17,0.04,3.54%,0.00,United Kingdom,,49678,,
LBRDA,Liberty Broadband Corporation Class A Common Stock,$147.73,-1.54,-1.032%,28854442040.00,United States,,52623,Consumer Services,Television Services
LBRDK,Liberty Broadband Corporation Class C Common Stock,$153.20,-1.655,-1.069%,29922835717.00,United States,,462033,Consumer Services,Television Services
LBRDP,Liberty Broadband Corporation Series A Cumulative Redeemable Preferred Stock,$26.85,0.08,0.299%,0.00,United States,,5297,Public Utilities,Telecommunications Equipment
LBTYA,Liberty Global plc Class A Ordinary Shares,$25.91,-0.18,-0.69%,14960758341.00,United Kingdom,,724201,,
